4658,4572,From the Heart - A Journey of Love,Hadel S. Ma'ayeh,4.83,6,1,96
4659,4572,Quartet for the End of Time,Johanna Skibsrud,2.63,172,1,96
4660,4572,"Blue Heaven (Blue, #7)",Josephine Dillon,4.36,28,1,96
4661,4572,The Annotated Archy and Mehitabel,Don Marquis,4.28,"1,750",1,96
4662,4572,"Chuck Palahniuk: Fight Club, Invisible Monsters, Choke",Francisco Collado-Rodriguez,4.20,49,1,96
4663,4572,"Dragon Haven (The Rain Wild Chronicles, #2)",Robin Hobb,4.11,"33,663",1,96
4664,4572,"Natchez Burning (Penn Cage, #4)",Greg Iles,4.16,"37,475",1,96
4665,4572,Angel of Death,Jennifer Hinsman,4.40,45,1,96
4666,4572,Lying Under the Apple Tree,Alice Munro,3.90,298,1,96
4667,4572,The Witch's Get,Diana Janopaul,4.17,95,1,96
4668,4572,Fireproof,Eric Wilson,4.47,"53,007",1,96
4669,4572,The Man Who Went into the West: The Life of R.S. Thomas,Byron Rogers,4.33,161,1,96
4670,4572,Beneath,H.B. Moore,3.88,177,1,96
4671,4572,又寂寞又美好,Jimmy Liao,4.27,254,1,96
4672,4572,The Map of Time,Félix J. Palma,3.39,"12,520",1,96
4673,4572,"Judas Unchained (Commonwealth Saga, #2)",Peter F. Hamilton,4.30,"36,196",2,96
4674,4572,"Clean Slate (Jim Knighthorse, #4)",J.R. Rain,4.23,640,1,96
4675,4572,Quail Farming: Markets and Marketing Strategies,Francis Otieno,4.75,12,1,96
4676,4572,What the Victorians Did for Us,Adam Hart-Davis,4.27,45,1,96
4677,4572,Homesick Creek,Diane Hammond,3.50,129,1,96
4678,4572,"Portrait of a Spy (Gabriel Allon, #11)",Daniel Silva,4.26,"28,675",1,96
4679,4572,"These Broken Stars (Starbound, #1)",Amie Kaufman,3.90,"68,519",1,96
4680,4572,Shadow Woman,Linda Howard,3.76,"8,840",1,96
4681,4572,"Silver Shadows (Bloodlines, #5)",Richelle Mead,4.34,"59,017",1,96
4682,4572,De ce iubim femeile,Mircea Cărtărescu,3.26,"6,022",1,96
4683,4572,"Pegasus and the Rise of the Titans (Pegasus, #5)",Kate O'Hearn,4.44,"3,324",1,96
4684,4572,"Laila Winter y la Maldición de Ithirïe (Laila Winter, #3)",Bárbara G. Rivero,4.25,186,1,96
4685,4572,Half a Chance,Cynthia Lord,3.99,"6,150",1,96
4686,4572,A Very Coco Christmas (Coco Pinchard #0.5),Robert Bryndza,3.89,942,1,96
4687,4572,Freedom Next Time,John Pilger,4.23,698,1,96
4688,4572,"Froi of the Exiles (Lumatere Chronicles, #2)",Melina Marchetta,4.29,"16,944",1,96
4689,4572,To The Lions,Claire Meadows,it,was,1,96
4690,4572,Effectuators 4: Sweet Albion,Paul Kidd,4.38,8,1,96
4691,4572,"Into the Silence: The Great War, Mallory, and the Conquest of Everest",Wade Davis,4.25,"4,097",1,96
4692,4572,"The Assassin's Curse (The Assassin's Curse, #1)",Cassandra Rose Clarke,3.68,"18,447",1,96
4693,4572,"Powers, Vol. 4: Supergroup",Brian Michael Bendis,4.17,"2,010",1,96
4694,4572,"Slave (Finding Anna, #1)",Sherri Hayes,3.87,"8,407",1,96
4695,4572,A Woman to Blame,Vincent Panettiere,4.37,227,1,96
4696,4572,"AlterWorld (Play to Live, #1)",D. Rus,4.14,"6,811",1,96
4697,4572,The Dying Grass,William T. Vollmann,4.14,450,1,96
4698,4572,"The Memory of Sky (Great Ship, #4)",Robert Reed,3.50,200,1,96
4699,4572,Sevara: Dawn of Hope,Damian Wampler,3.78,41,1,96
4700,4572,"Cinders (Xander Drew, #1)",Matthew Ledrew,3.87,15,1,96
4701,4572,The Mystic Saga (The Mystic Saga #1-3),Scott McElhaney,3.57,171,1,96
4702,4572,The Wisconsin Samurai,Scott McElhaney,4.80,15,1,96
4703,4572,Martha's Journey,Maureen Lee,4.09,378,1,96
4704,4572,Of the Andromeda Martian Catastrophe,Vegas Luna,4.58,36,1,96
4705,4572,"The Young World (The Young World, #1)",Chris Weitz,3.41,"4,917",1,96
4706,4572,Ongenaakbare Tornadojager,Annette Boon,3.50,16,1,96
4707,4572,Global Catastrophes and Trends: The Next Fifty Years,Vaclav Smil,4.06,233,1,96
4708,4572,Man Overboard: The Counterfeit Resurrection of Phil Champagne,Burl Barer,3.74,100,1,96
4709,4572,Алмазная колесница . Том 1 (Приключения Эраста Фандорина #10),Boris Akunin,4.53,649,1,96
4710,4572,The Bazaar of Bad Dreams,Stephen King,3.92,"57,527",1,96
4711,4572,"The Isle of the Lost (Descendants, #1)",Melissa de la Cruz,3.82,"24,645",1,96
4712,4572,"The Lady Penitent (Lady Penitent, #1-3)",Lisa Smedman,4.20,61,1,96
4713,4572,The House Girl,Tara Conklin,3.77,"60,800",1,96
4714,4572,"Goodnight, and Thanks for the Vodka [2002]",Harpie,4.30,120,1,96
4715,4572,Under My Hat: Tales from the Cauldron,Jonathan Strahan,3.90,"2,875",1,96
4716,4572,One Night in Winter (Moscow Trilogy #3),Simon Sebag Montefiore,3.96,"4,814",1,96
4717,4572,A Snicker of Magic,Natalie Lloyd,4.08,"13,319",1,96
4718,4572,Minor Gods (Summoners #1),A.M. Yates,4.01,289,1,96
4719,4572,"High Rhulain (Redwall, #18)",Brian Jacques,4.14,"8,370",1,96
4720,4572,الشخصية التونسية,المنصف وناس,3.29,52,1,96
4721,4572,The Things of Earth: Treasuring God by Enjoying His Gifts,Joe Rigney,4.47,"1,133",1,96
4722,4572,"Sacred Economics: Money, Gift, and Society in the Age of Transition",Charles Eisenstein,4.24,"1,633",1,96
4723,4572,Ich und die anderen,Matt Ruff,4.29,"5,617",1,96
4724,4572,John & George: The Dog Who Saved My Life,John    Dolan,4.05,211,1,96
4725,4572,Razzle Dazzle: The Battle for Broadway,Michael Riedel,4.17,"1,333",1,96
4726,4572,"Feral: Rewilding the Land, the Sea and Human Life",George Monbiot,4.17,"4,426",1,96
4727,4572,The Bridge to Holy Cross,Paullina Simons,4.29,"41,345",1,96
4728,4572,Paradise Travel,Jorge Franco,3.79,765,1,96
4729,4572,Barba Ensopada de Sangue,Daniel Galera,4.08,"3,086",1,96
4730,4572,"The Couturier of Milan (Ava Lee, #9)",Ian  Hamilton,3.93,819,1,96
4731,4572,She-Wolves: The Women Who Ruled England Before Elizabeth,Helen Castor,4.03,"7,558",2,96
4732,4572,Neutrino,Frank Close,4.08,662,1,96
4733,4572,"Console Wars: Sega, Nintendo, and the Battle that Defined a Generation",Blake J. Harris,3.96,"10,671",1,96
4734,4572,The Guardian (The Guardian Trilogy #1),Carol A. Robi,3.89,9,1,96
4735,4572,"Croak (Croak, #1)",Gina Damico,3.93,"10,930",2,96
4736,4572,"The Execution (Jeremy Fisk, #2)",Dick Wolf,3.87,"2,087",1,96
4737,4572,"Das unendliche Licht (Die Chroniken der Nebelkriege, #1)",Thomas Finn,4.09,311,1,96
4738,4572,"A Trick of the Light (Inspector McLevy, #3)",David Ashton,4.15,279,1,96
4739,4572,The Hourglass Factory,Lucy Ribchester,3.26,"2,062",1,96
4740,4572,Inferno (A Poet's Novel),Eileen Myles,3.90,"2,358",1,96
4741,4572,Killing the Rising Sun: How America Vanquished World War II Japan,Bill O'Reilly,4.35,"18,699",2,96
4742,4572,Glass House: The 1% Economy and the Shattering of the All-American Town,Brian  Alexander,3.91,"1,693",1,96
4743,4572,Bringing Up Bébé: One American Mother Discovers the Wisdom of French Parenting,Pamela Druckerman,4.01,"62,329",1,96
4744,4572,"Valor (The Faithful and the Fallen, #2)",John Gwynne,4.41,"21,513",1,96
4745,4572,Redwulf's Curse,Chris Priestley,3.52,44,1,96
4746,4572,"Lady Friday (The Keys to the Kingdom, #5)",Garth Nix,3.93,"22,235",1,96
4747,4572,"The Sacred Search: What If It's Not about Who You Marry, But Why?",Gary L. Thomas,4.29,"5,586",1,96
4748,4572,"Apples of Uncommon Character: Heirlooms, Modern Classics, and Little-Known Wonders",Rowan Jacobsen,4.36,238,2,96
4749,4572,Ruby,Cynthia Bond,3.65,"14,448",1,96
4750,4572,Out of the Wreckage: A New Politics in the Age of Crisis,George Monbiot,4.09,"1,789",1,96
4751,4572,"Die Tochter des Vercingetorix (Asterix, #38)",Jean-Yves Ferri,3.48,"2,705",1,96
4752,4572,"On Vanishing: Mortality, Dementia, and What It Means to Disappear",Lynn Casteel Harper,3.74,370,1,96
4753,4572,"The Devil's Advocate (The Wages of Sin, #1)",L.E.  Parker,3.98,42,1,96
4754,4572,Graham Greene: A Life In Letters,Graham Greene,4.05,125,1,96
4755,4572,Παλαιστές,Δημήτρης Καρακίτσος,4.17,12,1,96
4756,4572,Deaf Republic,Ilya Kaminsky,4.42,"7,163",1,96
4757,4572,They All Fall Down,Roxanne St. Claire,3.60,"6,611",1,96
4758,4572,Dystopia I,Terje Torkildsen,3.32,73,1,96
4759,4572,"The Second Temple Period (The Sages: Character, Context & Creativty, #1)",Binyamin Lau,4.31,108,1,96
4760,4572,"God is Great, God is Good: Why Believing In God Is Reasonable And Responsible","Chad Eds. Craig, William Lane & Meister",4.01,120,1,96
4761,4572,The Lost City of the Monkey God,Douglas Preston,3.92,"52,817",1,96
4762,4572,"Breaking Even (Sterling Shore, #5)",C.M. Owens,4.55,"7,012",2,96
4763,4572,Captivating Debutantes (The Captivating Debutantes #1-3),Emily Windsor,4.45,662,2,96
4764,4572,Milkweed,Jerry Spinelli,4.01,"28,589",1,96
4765,4572,Rain over Baghdad: An Egyptian Novel,Hala El Badry,3.56,16,1,96
4766,4572,Herkunft,Saša Stanišić,4.18,"8,410",1,96
4767,4572,Spillover: Animal Infections and the Next Human Pandemic,David Quammen,4.41,"17,572",1,96
4768,4572,Αστικά δύστυχα,Δημήτρης Γκιούλος,4.63,95,1,96
4769,4572,"Fire & Blood (A Targaryen History, #1)",George R.R. Martin,really,liked,1,96
4770,4572,"A Dog's Journey (A Dog's Purpose, #2)",W. Bruce Cameron,4.40,"29,303",1,96
4771,4572,"Appeasing Hitler: Chamberlain, Churchill and the Road to War",Tim Bouverie,4.35,"1,129",1,96
4772,4572,"Seventh Heaven (The Princess Diaries, #7)",Meg Cabot,3.69,"27,165",1,96
4773,4572,"The Complete Works of Rosa Luxemburg, Volume II: Economic Writings 2",Rosa Luxemburg,4.44,16,1,96
4774,4572,"Queen of Air and Darkness (The Dark Artifices, #3)",Clare  Cassandra,4.34,"103,721",1,96
4775,4572,Why Fish Don't Exist,Lulu Miller,4.18,"29,085",1,96
4776,4572,Rudolf Steiner,Rudolf Steiner,4.39,23,1,96
4777,4572,A Kind of Spark,Elle McNicoll,4.55,"5,586",2,96
4778,4572,"The Cellar (The Cellar, #1)",Natasha Preston,3.90,"61,684",1,96
4779,4572,Non è un paese per single,Felicia Kingsley,4.03,"3,571",1,96
4780,4572,The Prophets,Robert Jones Jr.,3.93,"18,902",1,96
4781,4572,Masters of the Planet: The Search for Our Human Origins,Ian Tattersall,4.06,"1,234",1,96
4782,4572,"The Slow Regard of Silent Things (The Kingkiller Chronicle, #2.5)",Patrick Rothfuss,3.89,"137,346",1,96
4783,4572,All Your Perfects,Colleen Hoover,4.12,"445,939",1,96
4784,4572,"Royal Captive (Fate of Eyrinthia, #3)",Heather Frost,4.65,382,1,96
4785,4572,Nothing But Blackened Teeth,Cassandra Khaw,2.70,"29,790",1,96
4786,4572,"Mad Love (DCYE, #3)",Lynessa Layne,4.25,150,1,96
4787,4572,Billy Summers,Stephen King,4.22,"129,215",1,96
4788,4572,In the Shadow of Statues: A White Southerner Confronts History,Mitch Landrieu,4.03,"2,814",1,96
4789,4572,"Paranormal Nonsense (Blue Moon Investigations, #1)",Steve Higgs,4.02,"1,897",1,96
4790,4572,Ejaculate Responsibly: A Whole New Way to Think About Abortion,Gabrielle Stanley Blair,4.58,"4,045",1,96
4791,4572,In at the Deep End,Kate       Davies,3.52,"7,100",1,96
4792,4793,Demonology,Rick Moody,3.41,"1,567",1,95
4793,4793,China Road: A Journey into the Future of a Rising Power,Rob Gifford,4.03,"3,871",1,95
4794,4793,Beyond the Green Zone: Dispatches from an Unembedded Journalist in Occupied Iraq,Dahr Jamail,4.29,171,1,95
4795,4793,"Fever and Spear (Your Face Tomorrow, #1)",Javier Marías,3.99,"3,026",1,95
4796,4793,Book of Clouds,Chloe Aridjis,3.39,"1,066",1,95
4797,4793,Magic for Beginners,Kelly Link,3.81,"9,447",1,95
4798,4793,The Oxford Companion to Shakespeare,Michael Dobson,4.19,73,1,95
4799,4793,Is the Qur'an God's Word? A Scientific Approach,"M.D. Ashouri, Sami",4.80,5,1,95
4800,4793,"When Men Become Gods: Mormon Polygamist Warren Jeffs, His Cult of Fear, and the Women Who Fought Back",Stephen Singular,3.79,"1,527",1,95
4801,4793,"Son of Perdition  (Chronicles of Brothers, #3)",Wendy Alec,4.37,"1,006",1,95
4802,4793,Zany Hijinx!: essays and other irrational prose,Thomas D. Waters,really,liked,1,95
4803,4793,Lavinia,Ursula K. Le Guin,3.84,"12,802",1,95
4804,4793,The Faces of Immortality,Everett Coles,4.44,9,1,95
4805,4793,"Nazi Germany and the Jews, 1933-1945",Saul Friedländer,4.13,300,1,95
4806,4793,Precious Blood,Jonathan Hayes,3.71,643,1,95
4807,4793,DO YOU THINK I'M BEAUTIFUL?,Angela Thomas,4.04,710,1,95
4808,4793,"Circles in the Stream (Avalon: Web of Magic, #1)",Rachel Roberts,4.09,"3,127",1,95
4809,4793,Life After Yes,Aidan Donnelley Rowley,3.40,502,1,95
4810,4793,Tim LaHaye Prophecy Study Bible –New King James Version,Anonymous,4.17,29,1,95
4811,4793,Degenerates,Neil D. Ostroff,4.36,11,1,95
4812,4793,Jadąc do Babadag,Andrzej Stasiuk,3.70,"1,477",1,95
4813,4793,"Spinward Fringe Broadcast 0: Origins (First Light Chronicles, #1-3; Spinward Fringe, #0)",Randolph Lalonde,4.02,"6,493",1,95
4814,4793,"The Fall of the Kings (Riverside, #3)",Ellen Kushner,3.65,"2,242",1,95
4815,4793,"Alpha (Shifters, #6)",Rachel Vincent,4.30,"14,742",1,95
4816,4793,Love on Trial: An American Scandal in Black and White,Heidi Ardizzone Ph.D.,3.75,101,1,95
4817,4793,Bringing Up Girls: Practical Advice and Encouragement for Those Shaping the Next Generation of Women,James C. Dobson,3.92,"2,807",1,95
4818,4793,Teenage Mermaid,Ellen Schreiber,3.68,"1,222",1,95
4819,4793,The Accordionist's Son,Bernardo Atxaga,3.76,603,1,95
4820,4793,Rogue Wave,Boyd Morrison,4.06,"2,375",1,95
4821,4793,Burning Bright,Ron Rash,4.11,"3,227",1,95
4822,4793,Broken,Daniel Clay,3.87,"2,246",1,95
4823,4793,Learn to Program with C++,John Smiley,4.43,7,1,95
4824,4793,The Post-Birthday World,Lionel Shriver,3.56,"14,285",1,95
4825,4793,The Russian Debutante's Handbook,Gary Shteyngart,3.55,"7,049",1,95
4826,4793,Year Zero,Jeff Long,3.60,"2,781",1,95
4827,4793,"The Last Stormlord (Watergivers, #1)",Glenda Larke,3.77,"6,991",1,95
4828,4793,Thug Lovin' (Thug #4),Wahida Clark,4.64,"3,468",1,95
4829,4793,"The Queen Must Die (Chronicles of Tempus, #1)",K.A.S. Quinn,3.70,336,1,95
4830,4793,A Complicated Kindness,Miriam Toews,3.67,"24,863",1,95
4831,4793,"The Darkest Night (Lords of the Underworld, #1)",Gena Showalter,4.05,"82,988",2,95
4832,4793,"The Real Lives of Strong Black Women: Transcending Myths, Reclaiming Joy",Toby Thompkins,4.24,17,1,95
4833,4793,Dilbert and the Way of the Weasel,Scott Adams,3.89,"1,358",1,95
4834,4793,Eurydice,Sarah Ruhl,4.14,"3,637",1,95
4835,4793,"A Tale Dark & Grimm (A Tale Dark & Grimm, #1)",Adam Gidwitz,4.07,"24,792",1,95
4836,4793,The Woman Who Swallowed a Toothbrush: And Other Weird Medical Case Histories,Rob Myers,3.62,570,1,95
4837,4793,"Enforcer (Cascadia Wolves, #1)",Lauren Dane,3.82,"4,547",1,95
4838,4793,Washington's Crossing,David Hackett Fischer,4.15,"14,533",1,95
4839,4793,Quirk,Brandi L. Bates,3.25,4,1,95
4840,4793,"Anew (The Archers of Avalon, #1)",Chelsea Fine,3.91,"14,210",1,95
4841,4793,"Clutter, Clutter & Peanut Butter: A Quick Guide To Organizing Your Messy Home, Office, LIFE!",D. Terry,it,was,1,95
4842,4793,Lost Boy Lost Girl,Peter Straub,3.49,"5,253",1,95
4843,4793,"Under the Rose (Secret Society Girl, #2)",Diana Peterfreund,3.92,"2,522",1,95
4844,4793,"Vixen (Flappers, #1)",Jillian Larkin,3.74,"8,105",1,95
4845,4793,Spilling the Beans,Clarissa Dickson Wright,3.82,973,1,95
4846,4793,"Obsidian (New Species, #8)",Laurann Dohner,4.19,"16,340",1,95
4847,4793,"Act Like a Lady, Think Like a Man: What Men Really Think About Love, Relationships, Intimacy, and Commitment",steve-harvey,3.79,"47,204",1,95
4848,4793,Vampire Rites Trilogy,Darren Shan,4.33,"2,842",1,95
4849,4793,Intelligent Universe,Ilyan Kei Lavanway,4.67,3,1,95
4850,4793,The Jester,James Patterson,3.81,"19,853",1,95
4851,4793,"Light (Gone, #6)",Michael  Grant,4.36,"38,268",2,95
4852,4793,Little Owl's Book Of Thinking,Ian Gilbert,3.69,36,1,95
4853,4793,"Ship Breaker (Ship Breaker, #1)",Paolo Bacigalupi,3.75,"43,605",1,95
4854,4793,De thuiskomst,Anna Enquist,3.82,"1,974",1,95
4855,4793,Immigration: United States Citizenship for Immigrants,Byron Goines,it,was,1,95
4856,4793,The Flame Alphabet,Ben Marcus,2.88,"5,264",1,95
4857,4793,Love and Summer,William Trevor,3.58,"3,976",1,95
4858,4793,Dangerous Joy (Company of Rogues #5),Jo Beverley,3.82,"1,824",1,95
4859,4793,My Pony,Susan Jeffers,4.11,336,1,95
4860,4793,Whispering To Witches,Anna Dale,3.86,"2,085",1,95
4861,4793,Bow Grip,Ivan E. Coyote,4.08,661,1,95
4862,4793,Abstraction In Theory - Laws Of Physical Transaction,Subhajit Ganguly,it,was,1,95
4863,4793,A Short History of Tractors in Ukrainian,Marina Lewycka,3.43,"32,441",1,95
4864,4793,The New Vichy Syndrome: Why European Intellectuals Surrender to Barbarism,Theodore Dalrymple,3.88,226,1,95
4865,4793,Binocular Vision: New and Selected Stories,Edith Pearlman,3.93,"2,201",1,95
4866,4793,"The Woman Behind the New Deal: The Life of Frances Perkins, FDR'S Secretary of Labor and His Moral Conscience",Kirstin Downey,4.21,"2,002",1,95
4867,4793,Mistress of the Wind,Michelle Diener,3.73,676,1,95
4868,4793,Kaiken käsikirja,Esko Valtaoja,3.75,923,1,95
4869,4793,My First Travel Book (My First Travel Books),Anna Othitis,4.58,180,1,95
4870,4793,Safely Home,Tom Eldredge,3.87,38,1,95
4871,4793,"Uninvited (Uninvited, #1)",Sophie Jordan,3.86,"13,266",1,95
4872,4793,"The Collector (Dante Walker, #1)",Victoria Scott,3.54,"8,704",1,95
4873,4793,"The Lost Scrolls (Rogue Angel, #6)",Alex Archer,3.67,886,1,95
4874,4793,"The Killing Moon (Dreamblood, #1)",N.K. Jemisin,3.95,"18,723",1,95
4875,4793,Comrade Fox: Low-living in Revolutionary Russia,Stewart Hennessey,3.48,71,1,95
4876,4793,The Lady in Yellow,Alyne de Winter,3.48,102,1,95
4877,4793,"Power of the Vampire (Saga of a World Called Htrae, #2)",Dee Krull,4.69,13,1,95
4878,4793,The Best of Archy and Mehitabel: Introduction by E. B. White (Everyman's Library Pocket Poets Series),Don Marquis,4.34,71,1,95
4879,4793,Let it Snow!  Season's Readings for a Super-Cool Yule!,Red Tash,3.41,109,1,95
4880,4793,How the Dead Dream,Lydia Millet,3.57,"1,166",2,95
4881,4793,"The Color of Heaven (The Color of Heaven, #1)",Julianne MacLean,4.14,"19,516",1,95
4882,4793,World History Biographies: Anne Frank: The Young Writer Who Told the World Her Story,Ann Kramer,4.12,308,1,95
4883,4793,A Short Stay in Hell,Steven L. Peck,4.23,"4,170",1,95
4884,4793,Classified Woman,Sibel Edmonds,4.37,474,1,95
4885,4793,"Curtsies & Conspiracies (Finishing School, #2)",Gail Carriger,4.13,"26,012",1,95
4886,4793,Suitable for Hanging,Lynne Stanshine,4.57,14,1,95
4887,4793,TOP SCHOOLS: Little Success Secrets,Francis Otieno,4.83,6,1,95
4888,4793,Beckon,Tom Pawlik,3.80,299,1,95
4889,4793,"Treasure of Khan (Dirk Pitt, #19)",Clive Cussler,3.94,"14,346",1,95
4890,4793,Amarbel/امربیل,Umera Ahmed,4.27,"2,036",1,95
4891,4793,"Seeking Allah, Finding Jesus: A Devout Muslim Encounters Christianity",Nabeel Qureshi,4.55,"28,788",1,95
4892,4793,Prey,Linda Howard,3.79,"9,578",1,95
4893,4793,"The Fiery Heart (Bloodlines, #4)",Richelle Mead,4.34,"74,770",1,95
4894,4793,The World of Ice & Fire: The Untold History of Westeros and the Game of Thrones,George R.R. Martin,4.26,"32,794",1,95
4895,4793,"Urchin and the Rage Tide (The Mistmantle Chronicles, #5)",M.I. McAllister,4.41,743,1,95
4896,4793,Kenta and the Big Wave,Ruth Ohi,4.16,182,1,95
4897,4793,"Pegasus and the Origins of Olympus (Pegasus, #4)",Kate O'Hearn,4.46,"4,513",1,95
4898,4793,"Forest Born (The Books of Bayern, #4)",Shannon Hale,4.04,"26,775",2,95
4899,4793,Germany: Memories of a Nation,Neil MacGregor,4.53,"3,054",1,95
4900,4793,1Q84 - Livro 2 (1Q84 #2),Haruki Murakami,4.10,"30,421",1,95
4901,4793,"Quintana of Charyn (Lumatere Chronicles, #3)",Melina Marchetta,4.31,"14,469",1,95
4902,4793,To Touch The Sun,Laura Enright,4.03,31,1,95
4903,4793,The Way of the Fox,Paul Kidd,4.20,20,1,95
4904,4793,The Meaning Of Sport,Simon Barnes,3.78,128,1,95
4905,4793,The Quickening Maze,Adam Foulds,3.13,"2,494",1,95
4906,4793,Playing (Less) Hurt: An Injury Prevention Guide for Musicians,Janet Horvath,4.38,47,1,95
4907,4793,News from Heaven: The Bakerton Stories,Jennifer Haigh,3.86,"1,741",1,95
4908,4793,All You Need Is Kill,Hiroshi Sakurazaka,4.03,"20,877",1,95
4909,4793,"Lord of the Storm (Coalition Rebellion, #1)",Justine Davis,3.82,"1,116",1,95
4910,4793,What I Talk About When I Talk About Running,Haruki Murakami,3.87,"151,515",1,95
4911,4793,Veronica,Mary Gaitskill,3.41,"5,904",1,95
4912,4793,"Map of Bones (Sigma Force, #2)",James Rollins,4.08,"59,647",1,95
4913,4793,"Darkest Hour (The Mediator, #4)",Jenny Carroll,4.16,"36,884",2,95
4914,4793,Tigerman,Nick Harkaway,3.92,"5,320",1,95
4915,4793,"Saga, Volume 3",Brian K. Vaughan,4.49,"92,000",1,95
4916,4793,Kitty and Her Sisters,Maureen Lee,4.11,576,1,95
4917,4793,Fossil (Colonization #5),Scott McElhaney,4.37,27,1,95
4918,4793,Tender Obsession,Steven Todd Fisher,it,was,1,95
4919,4793,Bogeyman - He Was Every Parent's Nightmare,Steve    Jackson,3.95,"1,013",1,95
4920,4793,"Ms. Marvel, Vol. 1: No Normal",G. Willow Wilson,4.11,"90,155",2,95
4921,4793,Le Voleur d'ombres,Marc Levy,3.91,"6,998",1,95
4922,4793,"I Am Her... (I Am Her..., #1)",Sarah Ann Walker,3.94,842,1,95
4923,4793,重力とは何か　アインシュタインから超弦理論へ、宇宙の謎に迫る (幻冬舎新書),大栗 博司,4.67,3,1,95
4924,4793,La Petite Bijou,Patrick Modiano,3.44,"3,138",1,95
4925,4793,2003 - Thanks for the Vodka,Harpie,3.56,932,1,95
4926,4793,"Annie, Between the States",L.M. Elliott,4.11,"2,080",1,95
4927,4793,Welcome to Braggsville,T. Geronimo Johnson,3.24,"3,430",1,95
4928,4793,Deep Down Popular,Phoebe Stone,3.64,"2,643",1,95
4929,4793,The Crane Wife,Patrick Ness,3.53,"8,052",1,95
4930,4793,Tattoos on the Heart: The Power of Boundless Compassion,Gregory Boyle,4.48,"23,784",1,95
4931,4793,The Prodigal God: Recovering the Heart of the Christian Faith,Timothy J. Keller,4.40,"38,479",1,95
4932,4793,Der Duft von Erde und Zitronen,Margherita Oggero,3.64,207,1,95
4933,4793,Rick Steves' Travel As a Political Act,Rick Steves,4.08,"3,351",1,95
4934,4793,The Great Reformer: Francis and the Making of a Radical Pope,Austen Ivereigh,4.18,572,1,95
4935,4793,Farmageddon: The True Cost of Cheap Meat,Philip Lymbery,4.24,966,1,95
4936,4793,The Lyrics:  1961-2012,Bob Dylan,4.62,327,1,95
4937,4793,Perla,Carolina De Robertis,3.96,"1,680",1,95
4938,4793,The Incarnations,Susan  Barker,3.77,"5,372",1,95
4939,4793,"Six Stories (Six Stories, #1)",Matt Wesolowski,3.79,"5,449",1,95
4940,4793,"The Devil in the White City: Murder, Magic, and Madness at the Fair That Changed America (Book Summary)",NOT A BOOK,4.29,14,1,95
4941,4793,Ainda estou aqui,Marcelo Rubens Paiva,4.27,559,1,95
4942,4793,"The Princeling of Nanjing (Ava Lee, #8)",Ian  Hamilton,3.98,860,1,95
4943,4793,I Don't Want To Be Crazy,Samantha Schutz,3.78,"5,571",1,95
4944,4793,"The Faith Club: A Muslim, A Christian, A Jew-- Three Women Search for Understanding",Suzanne Oliver,3.78,"5,426",1,95
4945,4793,"Spectred Isle (Green Men, #1)",K.J. Charles,4.13,"3,352",1,95
4946,4793,"Nevernight (The Nevernight Chronicle, #1)",Jay Kristoff,4.23,"86,556",1,95
4947,4793,Out of the Storm: Grappling with God in the Book of Job,Christopher Ash,4.48,189,1,95
4948,4793,"Tower of Dawn (Throne of Glass, #6)",Sarah J. Maas,4.27,"309,088",1,95
4949,4793,"Sweep: Volume 1 (Sweep, #1-3)",Cate Tiernan,4.26,"7,460",1,95
4950,4793,Law & Order: Crime Scenes,Dick Wolf,4.09,65,1,95
4951,4793,"Shadow of the Serpent (Inspector McLevy, #1)",David Ashton,3.54,808,1,95
4952,4793,The Good Women of China: Hidden Voices,Xinran,4.29,"11,338",1,95
4953,4793,Voices from D-Day,Jonathan Bastable,4.30,97,1,95
4954,4793,Phallos,Samuel R. Delany,3.84,115,1,95
4955,4793,"The Earth, My Butt, and Other Big Round Things",Carolyn Mackler,3.78,"27,201",1,95
4956,4793,El día del Watusi,Francisco Casavella,4.20,233,1,95
4957,4793,Before the Fall,Noah Hawley,3.72,"124,382",1,95
4958,4793,"Legacy (The Mystic Saga, #2)",Scott McElhaney,3.77,285,1,95
4959,4793,Fluent Forever: How to Learn Any Language Fast and Never Forget It,Gabriel Wyner,4.09,"10,372",1,95
4960,4793,Cooking for Picasso,Camille Aubray,3.87,"7,958",1,95
4961,4793,The Sleeper and the Spindle,Neil Gaiman,3.89,"48,631",1,95
4962,4793,"Last Stand of Dead Men (Skulduggery Pleasant, #8)",Derek Landy,4.58,"12,962",1,95
4963,4793,"Hunters of the Dusk (The Saga of Darren Shan, #7)",Darren Shan,4.17,"26,987",2,95
4964,4793,Pages for Her,Sylvia Brownrigg,3.73,"1,372",1,95
4965,4793,A History of the World in 6 Glasses,Tom Standage,3.80,"26,804",1,95
4966,4793,"Lyra's Oxford (His Dark Materials, #3.5)",Philip Pullman,3.61,"26,649",1,95
4967,4793,Godshot,Chelsea Bieker,3.78,"8,304",1,95
4968,4793,Persian Fire: The First World Empire and the Battle for the West,Tom Holland,4.15,"8,914",1,95
4969,4793,Τα σκαλοπάτια της Οδησσού,Σταμάτης Πολενάκης,4.20,5,1,95
4970,4793,The Volunteer: The True Story of the Resistance Hero who Infiltrated Auschwitz,Jack Fairweather,4.34,"6,419",1,95
4971,4793,Gallipoli,Peter FitzSimons,4.26,636,1,95
4972,4793,The Rose Cottage Tales (Tumtum and Nutmeg #4-6),Emily Bearn,4.26,546,1,95
4973,4793,"Caged (The Ke'lan, #2)",Skye Warren,3.21,212,1,95
4974,4793,Examined Lives: From Socrates to Nietzsche,James  Miller,3.79,630,1,95
4975,4793,Μείζονα Ποιητικά,Μιχάλης Κατσαρός,4.58,12,1,95
4976,4793,Did Jesus Rise From The Dead?,William Lane Craig,4.19,225,1,95
4977,4793,Freshwater,Akwaeke Emezi,4.03,"27,934",2,95
4978,4793,The Servant,Fatima Sharafeddine,3.72,443,1,95
4979,4793,Inverting the Pyramid: The History of Football Tactics,Jonathan  Wilson,4.15,"10,737",1,95
4980,4793,10 Minutes 38 Seconds in This Strange World,Elif Shafak,4.09,"52,913",1,95
4981,4793,Dog Days: James P. Cannon vs. Max Shachtman in the Communist League of America 1931-1933,James P. Cannon,3.17,6,1,95
4982,4793,"Harry Potter Boxset (Harry Potter, #1-7)",J.K. Rowling,4.74,"279,115",1,95
4983,4793,The Essential Rudolf Steiner,Rudolf Steiner,4.38,34,1,95
4984,4793,Anger Is My Middle Name: A Memoir,Lisbeth Zornig Andersen,4.12,"1,708",2,95
4985,4793,Lahtarit,Anneli Kanto,4.09,218,1,95
4986,4793,With the Fire on High,Elizabeth Acevedo,4.19,"79,499",1,95
4987,4793,Razorblade Tears,S.A. Cosby,4.10,"72,038",1,95
4988,4793,Why Be Happy When You Could Be Normal?,Jeanette Winterson,3.99,"39,185",1,95
4989,4793,The Mothers,Brit Bennett,3.90,"110,728",1,95
4990,4793,Give Me Your Hand,Megan Abbott,3.30,"19,205",2,95
4991,4793,The Adults,Caroline  Hulse,3.31,"6,148",2,95
