7308,7278,"Tribal Ways (Rogue Angel, #25)",Alex Archer,3.78,381,1,76
7309,7278,Gilles Deleuze,Claire Colebrook,3.94,472,1,76
7310,7278,A History of Polish Christianity,Jerzy Kloczowski,3.67,6,1,76
7311,7278,Crime and Criminals in Victorian London,Adrian Gray,3.60,67,1,76
7312,7278,American Nations: A History of the Eleven Rival Regional Cultures of North America,Colin Woodard,4.19,"11,288",1,76
7313,7278,"Soul Eater (Chronicles of Ancient Darkness, #3)",Michelle Paver,4.29,"12,376",1,76
7314,7278,De overgave,Arthur Japin,3.90,"3,900",1,76
7315,7278,Ghosts of 42nd Street: A History of America's Most Infamous Block,Anthony Bianco,3.72,79,1,76
7316,7278,"The Maze Runner Trilogy (Maze Runner, #1-3)",James Dashner,4.19,"8,698",1,76
7317,7278,The Radleys,Matt Haig,3.58,"20,089",1,76
7318,7278,Girl in a Blue Dress,Gaynor Arnold,3.56,"2,427",1,76
7319,7278,Ghost Hand,Ripley Patton,3.89,"1,054",1,76
7320,7278,The Undertaking,Audrey Magee,3.77,"3,283",1,76
7321,7278,"Sword Art Online, Vol. 02:  Aincrad (Sword Art Online Light Novel, #2)",Reki Kawahara,4.20,"4,737",1,76
7322,7278,The City of Your Final Destination,Peter    Cameron,3.86,"2,299",1,76
7323,7278,"Merry Christmas, Squirrels!",Nancy     Rose,4.10,327,1,76
7324,7278,The Zone of Interest,Martin Amis,3.69,"4,139",1,76
7325,7278,"Deadly Forecast (Psychic Eye Mystery, #11)",Victoria Laurie,4.21,"3,175",1,76
7326,7278,Mrs. Lincoln's Dressmaker,Jennifer Chiaverini,3.51,"28,560",1,76
7327,7278,"The Hunt for Dark Infinity (The 13th Reality, #2)",James Dashner,3.97,"10,809",2,76
7328,7278,The Shack,Tom Holtslander,3.07,242,1,76
7329,7278,The One Thing: The Surprisingly Simple Truth Behind Extraordinary Results,Gary Keller,4.13,"60,981",1,76
7330,7278,Prayer: Experiencing Awe and Intimacy with God,Timothy J. Keller,4.34,"11,355",1,76
7331,7278,The Secret of Ventriloquism,Jon Padgett,3.90,"1,821",1,76
7332,7278,The People's Chronology (Gale Non Series E Books),James Trager,it,was,1,76
7333,7278,We Never Asked for Wings,Vanessa Diffenbaugh,3.84,"19,331",1,76
7334,7278,The Gilded Years,Karin Tanabe,3.87,"7,987",2,76
7335,7278,Devotion,Patti Smith,3.85,"11,426",1,76
7336,7278,Tango: Stories of Desire in Poetry,Deborah Grace,4.50,2,1,76
7337,7278,"1st Semester (White Knight Dom Academy, #2)",Lucian Bane,4.52,240,1,76
7338,7278,Yes: My Improbable Journey to the Main Event of WrestleMania,Daniel   Bryan,4.09,"2,348",1,76
7339,7278,My Twentieth Century Evening and Other Small Breakthroughs: The Nobel Lecture,Kazuo Ishiguro,4.17,"1,239",2,76
7340,7278,"A Little Hatred (The Age of Madness, #1)",Joe Abercrombie,4.45,"35,518",1,76
7341,7278,"Little Dog, Lost",Marion Dane Bauer,3.94,"1,314",1,76
7342,7278,Women Around the Messenger,محمد قطب,4.28,426,1,76
7343,7278,"The Runaway (Valkyrie, #2)",Kate O'Hearn,4.41,"1,216",2,76
7344,7278,"A Higher Loyalty: Truth, Lies, and Leadership",James Comey,4.10,"47,223",2,76
7345,7278,The Undoing Project: A Friendship That Changed Our Minds,Michael   Lewis,3.98,"56,982",1,76
7346,7278,The Push,Ashley Audrain,4.08,"268,987",1,76
7347,7278,"Mao's Great Famine: The History of China's Most Devastating Catastrophe, 1958-62",Frank Dikötter,4.05,"4,096",1,76
7348,7278,"DragonLight (DragonKeeper Chronicles, #5)",Donita K. Paul,4.25,"4,059",1,76
7349,7278,The Chickens of Atlantis and Other Foul and Filthy Fiends,Robert Rankin,3.79,177,1,76
7350,7278,"The Shadow Crosser (The Storm Runner, #3)",J.C. Cervantes,4.42,"2,065",1,76
7351,7352,"The First Man-Made Man: The Story of Two Sex Changes, One Love Affair, and a Twentieth-Century Medical Revolution",Pagan Kennedy,3.67,319,1,75
7352,7352,William Mulholland and the Rise of Los Angeles,Catherine Mulholland,3.71,85,1,75
7353,7352,"The Dark Divine (The Dark Divine, #1)",Bree Despain,3.79,"37,962",1,75
7354,7352,"Just Like Me, Only Better",Carol Snow,3.42,882,1,75
7355,7352,"Misguided Angel (Blue Bloods, #5)",Melissa de la Cruz,3.93,"38,909",1,75
7356,7352,Overtaken,Alexei Sayle,3.66,301,1,75
7357,7352,Abandoned (Smoky Barrett #4),Cody McFadyen,4.15,"7,094",1,75
7358,7352,The Mermaid's Mirror,L.K. Madigan,3.69,"4,313",1,75
7359,7352,"Skinned (Cold Awakening, #1)",Robin Wasserman,3.54,"12,848",1,75
7360,7352,"The Darlings in Love (The Darlings are Forever, #2)",Melissa Kantor,3.72,521,1,75
7361,7352,"Web of Lies (Elemental Assassin, #2)",Jennifer Estep,4.10,"22,609",1,75
7362,7352,"Double Inferno  (The Sinful 7 of Delite, Texas, #2)",Dixie Lynn Dwyer,4.08,460,1,75
7363,7352,Forrestal Lecture at the US Naval Academy,Robert A. Heinlein,4.47,15,1,75
7364,7352,"Cursor's Fury (Codex Alera, #3)",Jim Butcher,4.36,"65,577",1,75
7365,7352,"Toxic Heart (Mystic City, #2)",Theo Lawrence,3.71,"2,793",1,75
7366,7352,Beethoven Was One-Sixteenth Black and Other Stories,Nadine Gordimer,3.19,619,1,75
7367,7352,Hele dagen in de regen,Henna Goudzand Nahar,2.75,4,1,75
7368,7352,"The World of Divergent: The Path to Allegiant (Divergent, #2.5)",Veronica Roth,3.94,"33,961",1,75
7369,7352,Escape from Camp 14,Blaine Harden,really,liked,1,75
7370,7352,"Broken Angels (Takeshi Kovacs, #2)",Richard K. Morgan,3.93,"35,308",1,75
7371,7352,Scars,Cheryl Rainfield,4.16,"14,982",1,75
7372,7352,A Place Called Here,Cecelia Ahern,3.68,"33,574",1,75
7373,7352,"There is No Light in Darkness (Darkness, #1)",Claire Contreras,4.07,"14,340",1,75
7374,7352,"Our Aesthetic Categories: Zany, Cute, Interesting",Sianne Ngai,4.36,268,1,75
7375,7352,"Kill the Dead (Sandman Slim, #2)",Richard Kadrey,4.07,"20,337",1,75
7376,7352,"Natural Born Charmer (Chicago Stars, #7)",Susan Elizabeth Phillips,4.15,"35,556",1,75
7377,7352,Access To Power,Robert  Ellis,3.97,"1,294",1,75
7378,7352,La rêveuse d'Ostende,Éric-Emmanuel Schmitt,3.94,"3,199",1,75
7379,7352,"The Dragon's Mark (Rogue Angel, #26)",Alex Archer,3.81,376,1,75
7380,7352,Batman Incorporated (2010 - 2011) #1,Grant Morrison,3.72,40,1,75
7381,7352,Stone Mattress: Nine Tales,Margaret Atwood,3.89,"23,646",1,75
7382,7352,Figure and Ground,Steven M. Boker,liked,it,1,75
7383,7352,Doctor Who: I Am a Dalek,Gareth Roberts,3.77,"1,680",1,75
7384,7352,Spirit Walker (Chronicles of Ancient Darkness #2),Michelle Paver,4.28,"15,596",1,75
7385,7352,My Story: The Blitz,Vince Cross,3.65,733,1,75
7386,7352,The Demon Trapper's Daughter: A Demon Trappers Novel,Jana Oliver,3.99,"18,361",1,75
7387,7352,The Place You Love Is Gone: Progress Hits Home,Melissa Holbrook Pierson,3.50,82,1,75
7388,7352,"The Burning Wire (Lincoln Rhyme, #9)",Jeffery Deaver,4.04,"18,573",1,75
7389,7352,"Ancillary Sword (Imperial Radch, #2)",Ann Leckie,4.07,"50,285",1,75
7390,7352,Barracuda,Christos Tsiolkas,3.69,"8,530",2,75
7391,7352,"Rot & Ruin (Rot & Ruin, #1)",Jonathan Maberry,4.10,"34,578",1,75
7392,7352,The Visible World,Mark Slouka,3.43,"1,196",1,75
7393,7352,Te retrouver,Fabio Volo,3.43,995,1,75
7394,7352,The Dorito Effect: The Surprising New Truth About Food and Flavor,Mark Schatzker,4.02,"7,367",1,75
7395,7352,"Half Wild (The Half Bad Trilogy, #2)",Sally Green,3.99,"21,874",1,75
7396,7352,Doctor Who: The Rapture,Joseph Lidster,liked,it,2,75
7397,7352,"Sword Art Online, Vol. 03: Fairy Dance (Sword Art Online Light Novel, #3)",Reki Kawahara,4.13,"3,846",1,75
7398,7352,The Financial Lives of the Poets,Jess Walter,3.70,"10,542",1,75
7399,7352,Juno & Juliet,Julian Gough,3.46,681,1,75
7400,7352,"Abby Cooper, Psychic Eye (Psychic Eye Mystery, #1)",Victoria Laurie,3.94,"14,080",1,75
7401,7352,"Undisputed: How to Become the World Champion in 1,372 Easy Steps",Chris Jericho,4.17,"3,954",1,75
7402,7352,"An Autumn War (Long Price Quartet, #3)",Daniel Abraham,4.05,"6,924",1,75
7403,7352,"The Runaway Quilt (Elm Creek Quilts, #4)",Jennifer Chiaverini,4.14,"7,400",1,75
7404,7352,Deadly Design,Debra Dockter,3.87,495,1,75
7405,7352,Paleo Sweets,Kelsey Ale,3.64,11,1,75
7406,7352,Man Made: A Stupid Quest for Masculinity,Joel Stein,3.75,"1,067",1,75
7407,7352,Revolution 1989: The Fall of the Soviet Empire,Victor Sebestyen,4.34,"1,273",1,75
7408,7352,Jacob's Oath,Martin Fletcher,3.87,916,1,75
7409,7352,Paper Wife,Laila Ibrahim,4.12,"23,273",2,75
7410,7352,Instant Light: Tarkovsky Polaroids,Andrei Tarkovsky,4.41,639,1,75
7411,7352,Enlivenment: Toward a Poetics for the Anthropocene,Andreas Weber,4.21,48,1,75
7412,7352,Undying: A Love Story,Michel Faber,4.33,796,1,75
7413,7352,Beren and Lúthien,J.R.R. Tolkien,4.02,"15,730",1,75
7414,7352,La réunification des deux Corées,Joël Pommerat,3.91,99,1,75
7415,7352,Ruin Box Set 1-3,Lucian Bane,4.13,159,1,75
7416,7352,I'm Thinking of Ending Things,Iain Reid,3.58,"130,199",1,75
7417,7352,The Familiars,Stacey Halls,3.88,"41,103",1,75
7418,7352,The Reckless Oath We Made,Bryn Greenwood,really,liked,1,75
7419,7352,Ring Shout,P. Djèlí Clark,4.04,"27,164",1,75
7420,7352,"George, Nicholas and Wilhelm: Three Royal Cousins and the Road to World War I",Miranda Carter,4.03,"3,864",1,75
7421,7352,Be Frank With Me,Julia Claiborne Johnson,3.89,"21,956",1,75
7422,7352,"Empire of Sand (The Books of Ambha, #1)",Tasha Suri,3.83,"10,379",1,75
7423,7352,L'arco di trasformazione del personaggio,Dara Marks,4.44,377,1,75
7424,7352,Firekeeper's Daughter,Angeline Boulley,4.35,"119,229",2,75
7425,7352,9 From the Nine Worlds,Rick Riordan,3.97,"11,537",1,75
7426,7427,"In Our Hearts We Were Giants: The Remarkable Story of the Lilliput Troupe, a Dwarf Family's Survival of the Holocaust",Yehuda Koren,4.14,834,1,74
7427,7427,Chances of a Lifetime: A Memoir,Warren Christopher,3.92,50,1,74
7428,7427,Happyslapped by a Jellyfish: The Words of Karl Pilkington,Karl Pilkington,3.93,"3,901",1,74
7429,7427,Love Lessons,Jacqueline Wilson,3.54,"6,287",1,74
7430,7427,The Night She Died,Jennifer Patrick,3.75,63,1,74
7431,7427,"Split Second (Maggie O'Dell, #2)",Alex Kava,4.09,"8,596",1,74
7432,7427,"The Darker Side (Smoky Barrett, #3)",Cody McFadyen,4.12,"6,942",1,74
7433,7427,Kissing Snowflakes,Abby Sher,3.54,881,1,74
7434,7427,"The Man in the Wooden Hat (Old Filth, #2)",Jane Gardam,4.06,"6,972",1,74
7435,7427,"Dead Tomorrow (Roy Grace, #5)",Peter James,4.21,"9,352",1,74
7436,7427,"The Darlings Are Forever (The Darlings Are Forever, #1)",Melissa Kantor,3.72,761,1,74
7437,7427,"The Iron Hunt (Hunter Kiss, #1)",Marjorie M. Liu,3.62,"5,851",1,74
7438,7427,"Chain Reaction (Perfect Chemistry, #3)",Simone Elkeles,4.09,"62,938",1,74
7439,7427,"Double Infiltration (The Sinful 7 of Delite, Texas, #4)",Dixie Lynn Dwyer,4.20,357,1,74
7440,7427,"Cuentos Chinos: El engaño de Washington, la mentira populista y la esperanza de América Latina",Andrés Oppenheimer,3.89,934,1,74
7441,7427,Off the Main Sequence: The Other Science Fiction Stories of Robert A. Heinlein,Robert A. Heinlein,3.96,287,1,74
7442,7427,"Captain's Fury (Codex Alera, #4)",Jim Butcher,4.37,"64,818",1,74
7443,7427,The Other Side of You: A Novel,Salley Vickers,3.78,"1,457",1,74
7444,7427,State of Fear,Michael Crichton,3.70,"85,129",2,74
7445,7427,"Harry Potter and the Order of the Phoenix (Harry Potter, #5, Part 1)",J.K. Rowling,4.61,"223,371",1,74
7446,7427,"Four: The Initiate (Divergent, #0.2)",Veronica Roth,4.16,"25,047",1,74
7447,7427,"Woken Furies (Takeshi Kovacs, #3)",Richard K. Morgan,4.02,"29,409",1,74
7448,7427,The Moon and More,Sarah Dessen,3.62,"39,573",1,74
7449,7427,"By the Time You Read This, I'll Be Dead",Julie Anne Peters,3.85,"23,037",1,74
7450,7427,Thanks for the Memories,Cecelia Ahern,3.70,"43,414",1,74
7451,7427,The Woman Who Wasn't There: The True Story of an Incredible Deception,Robin Gaby Fisher,3.78,"2,915",1,74
7452,7427,"From Ashes (From Ashes, #1)",Molly McAdams,4.12,"27,728",1,74
7453,7427,"Alex Cross's Trial (Alex Cross, #15)",James Patterson,3.98,"27,832",1,74
7454,7427,The Program Era: Postwar Fiction and the Rise of Creative Writing,Mark McGurl,3.89,177,1,74
7455,7427,The Ruling Class: How They Corrupted America and What We Can Do About It,Angelo M. Codevilla,4.24,237,1,74
7456,7427,"Aloha from Hell (Sandman Slim, #3)",Richard Kadrey,4.03,"16,619",1,74
7457,7427,Savage Dawn (Savage #35),Cassie Edwards,4.22,172,1,74
7458,7427,"The Protégé (Christian Gillette, #2)",Stephen W. Frey,3.90,"1,191",1,74
7459,7427,"Phantom Prospect (Rogue Angel, #27)",Alex Archer,3.68,346,1,74
7460,7427,The Hidden Reality: Parallel Universes and the Deep Laws of the Cosmos,Brian Greene,4.10,"19,278",1,74
7461,7427,Batman: The Black Glove,Grant Morrison,3.76,"1,761",1,74
7462,7427,Sagen om de japanske dræbergardiner,Dennis Jürgensen,3.91,137,1,74
7463,7427,Bog Baby,Jeanne Willis,4.17,518,1,74
7464,7427,We Want Real Food,graham-harvey,really,liked,1,74
7465,7427,"In Black and White: The Life of Sammy Davis, Jr.",Wil Haygood,4.03,158,1,74
7466,7427,"The Cold Moon (Lincoln Rhyme, #7)",Jeffery Deaver,4.06,"18,995",1,74
7467,7427,"The Maze Runner Series  (The Maze Runner, #0.4-3)",James Dashner,4.24,"15,395",1,74
7468,7427,Schild's Ladder,Greg Egan,3.93,"3,556",1,74
7469,7427,Undisputed Truth: My Autobiography,Mike Tyson,4.17,"8,935",1,74
7470,7427,"Dreaming in Chinese: Mandarin Lessons in Life, Love, And Language",Deborah Fallows,3.62,"2,118",1,74
7471,7427,"Mes amis, mes amours",Marc Levy,3.49,"4,227",1,74
7472,7427,"Whispered Lies (B.A.D. Agency, #3)",Sherrilyn Kenyon,4.08,"3,182",1,74
7473,7427,Baby Proof,Emily Giffin,3.75,"165,148",2,74
7474,7427,Desert Blood: The Juarez Murders,Alicia Gaspar De Alba,4.01,592,1,74
7475,7427,"Half Lies (The Half Bad Trilogy, #0.5)",Sally Green,3.79,"3,066",1,74
7476,7427,"Sword Art Online, Vol. 04: Fairy Dance (Sword Art Online Light Novel, #4)",Reki Kawahara,4.17,"3,413",1,74
7477,7427,"Spies of the Balkans (Night Soldiers, #11)",Alan Furst,3.92,"5,922",1,74
7478,7427,"Goodbye, Piccadilly: War at Home, 1914",Cynthia Harrod-Eagles,3.85,783,1,74
7479,7427,"Better Read Than Dead (Psychic Eye Mystery, #2)",Victoria Laurie,really,liked,1,74
7480,7427,Bilješke jedne gimnazijalke,Nada Mihelčić,3.98,287,1,74
7481,7427,"The Sugar Camp Quilt (Elm Creek Quilts, #7)",Jennifer Chiaverini,4.09,"5,982",1,74
7482,7427,Theory of a Tramp,Pamela Caves,3.46,13,1,74
7483,7427,"The Squared Circle: Life, Death, and Professional Wrestling",David    Shoemaker,3.96,"2,063",1,74
7484,7427,"Wild Thing (Peter Brown, #2)",Josh Bazell,3.34,"3,416",1,74
7485,7427,A Wind in the House of Islam,David Garrison,4.34,696,1,74
7486,7427,"Killing November (Killing November, #1)",Adriana Mather,4.17,"10,092",1,74
7487,7427,On Suicide Bombing,Talal Asad,3.99,354,1,74
7488,7427,The Wives of Henry Oades,Johanna Moran,3.61,"2,838",1,74
7489,7427,"Φιλοσοφία, ηθική και θρησκεία",Mikhail Bakunin,3.90,29,1,74
7490,7427,Spring Garden,Tomoka Shibasaki,3.27,"1,118",1,74
7491,7427,Captain Pike Looks After the Baby,Kate Pankhurst,4.40,10,1,74
7492,7427,The Lies That Bind: Rethinking Identity,Kwame Anthony Appiah,3.85,"1,761",1,74
7493,7427,"Tales from a Not-So-Talented Pop Star (Dork Diaries, #3)",Rachel Renée Russell,4.26,"45,900",1,74
7494,7427,The BreakBeat Poets: New American Poetry in the Age of Hip-Hop,Kevin Coval,4.31,560,1,74
7495,7427,Call Your Daughter Home,Deb Spera,4.24,"34,192",1,74
7496,7427,Mr. Dickens and His Carol,Samantha Silva,3.79,"13,734",1,74
7497,7427,"The Priory of the Orange Tree (The Roots of Chaos, #1)",Samantha    Shannon,4.23,"148,326",1,74
7498,7427,"The Admirals: Nimitz, Halsey, Leahy, and King—the Five-Star Admirals Who Won the War at Sea",Walter R. Borneman,4.31,"3,920",1,74
7499,7427,"Scarlet (King Raven, #2)",Stephen R. Lawhead,4.02,"9,144",1,74
7500,7501,The Life of the Skies: Birding at the End of Nature,Jonathan Rosen,3.74,277,1,73
7501,7501,Doctors from Hell: The Horrific Account of Nazi Experiments on Humans,Vivien Spitz,3.98,"2,267",1,73
7502,7501,"The Soul Catcher (Maggie O'Dell, #3)",Alex Kava,3.99,"6,724",1,73
7503,7501,"The Face of Death (Smoky Barrett, #2)",Cody McFadyen,4.25,"8,447",1,73
7504,7501,"Lucky (Avery Sisters Trilogy, #1)",Rachel Vail,3.42,"1,925",1,73
7505,7501,Meeting Him in the Wilderness: A True Story of Adventure and Faith,Lois E. Olson,4.47,17,1,73
7506,7501,The Puppet and the Dwarf: The Perverse Core of Christianity,Slavoj Žižek,3.83,737,1,73
7507,7501,Thinner Than Thou,Kit Reed,3.18,410,1,73
7508,7501,"Not Dead Enough (Roy Grace, #3)",Peter James,4.13,"11,869",1,73
7509,7501,"Bone Gods (Black London, #3)",Caitlin Kittredge,3.74,"1,059",1,73
7510,7501,Time Spike,Eric Flint,3.67,826,1,73
7511,7501,Galileo's Dream,Kim Stanley Robinson,3.57,"2,906",1,73
7512,7501,Outward Bound,Robert A. Heinlein,4.01,403,1,73
7513,7501,"Academ's Fury (Codex Alera, #2)",Jim Butcher,4.26,"67,913",1,73
7514,7501,"Talk to the Hand: The Utter Bloody Rudeness of the World Today, or Six Good Reasons to Stay Home and Bolt the Door",Lynne Truss,3.32,"3,452",1,73
7515,7501,No Time Like the Present,Nadine Gordimer,3.18,614,1,73
7516,7501,"The Traitor (Divergent, #0.4)",Veronica Roth,4.15,"19,024",1,73
7517,7501,The Supremes at Earl's All-You-Can-Eat: Library Edition,Edward Kelsey Moore,3.98,"12,525",1,73
7518,7501,Unteachable,Leah Raeder,3.76,"22,798",1,73
7519,7501,"John Green the Collection: Looking for Alaska / An Abundance of Katherines / Paper Towns / Will Grayson, Will Grayson / The Fault in Our Stars",John Green,4.49,"3,250",1,73
7520,7501,Modern Times Revised Edition: The World from the Twenties to the Nineties,Paul  Johnson,4.27,"2,713",1,73
7521,7501,"Devil Said Bang (Sandman Slim, #4)",Richard Kadrey,4.04,"12,454",1,73
7522,7501,Savage Flames (Savage #32),Cassie Edwards,4.18,228,1,73
7523,7501,"The Rogue Hunter (Argeneau, #10; Rogue Hunter, #1)",Lynsay Sands,4.17,"17,088",2,73
7524,7501,"Touch of Power (Healer, #1)",Maria V. Snyder,4.13,"44,948",1,73
7525,7501,"The Chairman (Christian Gillette, #1)",Stephen W. Frey,3.98,"2,615",1,73
7526,7501,The List,Siobhan Vivian,3.40,"28,821",1,73
7527,7501,"Restless Soul (Rogue Angel, #28)",Alex Archer,3.68,318,1,73
7528,7501,"Smaragdgrün (Edelstein-Trilogie, #3)",Kerstin Gier,4.20,"93,422",1,73
7529,7501,Beach Girls,Luanne Rice,4.08,"9,199",1,73
7530,7501,"The Empire of Necessity: Slavery, Freedom, and Deception in the New World",Greg Grandin,3.96,862,1,73
7531,7501,Arnie Jenks and the House of Strangers,Tim Bradley,3.17,6,1,73
7532,7501,The Conductor,Sarah Quigley,3.83,946,1,73
7533,7501,The Race for Timbuktu: In Search of Africa's City of Gold,Frank T. Kryza,3.84,459,1,73
7534,7501,The Luckiest Man in Football,Mamady Sidibe,really,liked,1,73
7535,7501,The Outcasts of 19 Schuyler Place,E.L. Konigsburg,3.82,"4,774",1,73
7536,7501,The Facebook Effect: The Inside Story of the Company That is Connecting the World,David   Kirkpatrick,3.86,"11,825",1,73
7537,7501,"Quintessentially Q (Monsters in the Dark, #2)",Pepper Winters,4.32,"21,154",1,73
7538,7501,"The Reckoning (John Madden, #4)",Rennie Airth,4.08,"1,627",1,73
7539,7501,"Warm Up  (Villains, #0.5)",V.E. Schwab,3.78,"8,390",1,73
7540,7501,"Infernal Devices (The Hungry City Chronicles, #3)",Philip Reeve,3.88,"16,042",1,73
7541,7501,"End of Watch (Bill Hodges Trilogy, #3)",Stephen King,4.09,"110,822",1,73
7542,7501,Doctor Who: Master,Joseph Lidster,4.20,425,1,73
7543,7501,"Sword Art Online, Vol. 05: Phantom Bullet (Sword Art Online Light Novel, #5)",Reki Kawahara,4.29,"2,993",1,73
7544,7501,"The Life and Death of Lily Drake (Lily Drake, #1)",T. Michelle Nelson,4.09,152,1,73
7545,7501,Wildflower Hill,Kimberley Freeman,4.10,"13,026",2,73
7546,7501,Torsdagsänkorna,Claudia Piñeiro,3.56,"4,118",1,73
7547,7501,"A Vision of Murder (Psychic Eye Mystery, #3)",Victoria Laurie,3.96,"6,818",1,73
7548,7501,"A Boy Called Christmas (Christmas, #1)",Matt Haig,4.16,"20,136",1,73
7549,7501,"Seeds of Rebellion (Beyonders, #2)",Brandon Mull,4.28,"29,758",1,73
7550,7501,"Execution (Escape from Furnace, #5)",Alexander Gordon Smith,4.37,"4,042",2,73
7551,7501,In My Blood,Lina Langley,1.89,9,1,73
7552,7501,The Tinkerer's Accomplice: How Design Emerges from Life Itself,J. Scott Turner,4.29,31,1,73
7553,7501,The Mushroom at the End of the World: On the Possibility of Life in Capitalist Ruins,Anna Lowenhaupt Tsing,4.03,"4,916",1,73
7554,7501,Secrets She Kept,Cathy Gohlke,4.29,"3,392",1,73
7555,7501,Περί Σουρρεαλισμού - Η διάλεξη του 1935,Andreas Embirikos,4.25,24,1,73
7556,7501,A Naked Singularity,Sergio de la Pava,4.12,"2,605",1,73
7557,7501,Midwinter Break,Bernard MacLaverty,3.62,"4,893",1,73
7558,7501,Aquarium,David Vann,3.75,"4,589",1,73
7559,7501,"Dirt Matters: The Foundation For a Healthy, Vibrant, And Effective Congregation",Jim Powell,4.34,58,1,73
7560,7501,Flash Boys: A Wall Street Revolt,Michael   Lewis,4.14,"80,125",1,73
7561,7501,De Niro's Game,Rawi Hage,3.78,"3,770",1,73
7562,7501,The Uninhabitable Earth: Life After Warming,David Wallace-Wells,4.02,"25,360",1,73
7563,7501,The Dogs of Christmas,W. Bruce Cameron,4.01,"6,461",1,73
7564,7501,Great North Road,Peter F. Hamilton,4.07,"16,729",1,73
7565,7501,The Amputee's Guide to Sex,Jillian Weise,4.22,288,1,73
7566,7501,"Thanks a Lot, Mr. Kibblewhite: My Story",Roger Daltrey,4.05,"4,007",1,73
7567,7501,Members Only,Sameer Pandya,3.93,"1,562",1,73
7568,7501,"Iron Gold (Red Rising Saga, #4)",Pierce Brown,4.23,"68,616",1,73
7569,7501,"Stonefather (Mither Mages, #0.5)",Orson Scott Card,3.85,"2,941",1,73
7570,7501,The Matchmaker's Gift,Lynda Cohen Loigman,4.18,"10,995",1,73
7571,7501,Shakespeare for Squirrels,Christopher Moore,3.90,"7,345",1,73
7572,7501,Ideas to Postpone the End of the World,Ailton Krenak,4.25,"3,776",1,73
7573,7501,"The Okay Witch (The Okay Witch, #1)",Emma Steinkellner,4.18,"9,558",1,73
7574,7575,The Inextinguishable Symphony: A True Story of Music and Love in Nazi Germany,Martin Goldsmith,4.20,"1,018",1,72
7575,7575,"Powers (Annals of the Western Shore, #3)",Ursula K. Le Guin,4.05,"4,825",1,72
7576,7575,"Wolfsbane (Nightshade, #2; Nightshade World, #5)",Andrea Cremer,4.11,"47,124",1,72
7577,7575,"At the Stroke of Madness (Maggie O'Dell, #4)",Alex Kava,really,liked,1,72
7578,7575,"Magierlicht (Sturmjäger von Aradon, #2)",Jenny-Mai Nuyen,3.88,455,1,72
7579,7575,"Shadow Man (Smoky Barrett, #1)",Cody McFadyen,4.15,"13,102",1,72
7580,7575,While I'm Falling,Laura Moriarty,3.48,"4,373",1,72
7581,7575,After the Kiss,Terra Elan McVoy,3.22,"1,142",1,72
7582,7575,The Day John Died,Christopher Andersen,4.18,"1,122",1,72
7583,7575,"The Lying Game (The Lying Game, #1)",Sara Shepard,3.91,"41,524",1,72
7584,7575,"Heroes at Risk (Hero, #4)",Moira J. Moore,3.66,"1,632",1,72
7585,7575,The Ghost Writer,Robert   Harris,3.77,"16,381",1,72
7586,7575,"Son of the Mob (Son of the Mob, #1)",Gordon Korman,3.72,"6,802",1,72
7587,7575,"Demon Bound (Black London, #2)",Caitlin Kittredge,3.73,"1,807",1,72
7588,7575,"Return to Paradise (Leaving Paradise, #2)",Simone Elkeles,4.03,"33,344",1,72
7589,7575,"Arctic Winds (Alpine Woods Shifters, #1)",Sondrae Bennett,3.64,"2,567",1,72
7590,7575,Stupid White Men,Michael Moore,3.33,"16,168",1,72
7591,7575,Infinite Possibilities,Robert A. Heinlein,4.07,306,1,72
7592,7575,"Ghost Story (The Dresden Files, #13)",Jim Butcher,4.25,"94,929",1,72
7593,7575,The Garden of Last Days,Andre Dubus III,3.50,"4,977",1,72
7594,7575,"This World We Live In (Last Survivors, #3)",Susan Beth Pfeffer,3.80,"32,040",1,72
7595,7575,Swimsuit,James Patterson,3.66,"25,539",1,72
7596,7575,"The Barbarous Years: The Peopling of British North America: The Conflict of Civilizations, 1600-1675",Bernard Bailyn,3.91,"1,003",1,72
7597,7575,"Harry Potter Collection (Harry Potter, #1-6)",J.K. Rowling,4.72,"32,545",1,72
7598,7575,"The Search for WondLa (The Search for WondLa, #1)",Tony DiTerlizzi,4.09,"12,459",1,72
7599,7575,White Dog Fell from the Sky,Eleanor  Morse,4.04,"3,625",1,72
7600,7575,Somewhere Beneath Those Waves,Sarah Monette,4.08,635,1,72
7601,7575,"Double or Die (Young Bond, #3)",Charlie Higson,4.08,"6,243",1,72
7602,7575,The Face,Dean Koontz,3.74,"22,083",2,72
7603,7575,"Nightfall (Jack Nightingale, #1)",Stephen Leather,3.96,"3,998",1,72
7604,7575,Savage Skies (Savage #30),Cassie Edwards,4.20,433,1,72
7605,7575,"Black Fridays (Jason Stafford, #1)",Michael Sears,3.74,"1,941",1,72
7606,7575,"False Horizon (Rogue Angel, #29)",Alex Archer,3.77,320,1,72
7607,7575,"Batman, Volume 2: The City of Owls",Scott Snyder,4.26,"26,947",1,72
7608,7575,"Twenty Wishes (Blossom Street, #5)",Debbie Macomber,4.18,"17,916",1,72
7609,7575,Hollywood Westerns and American Myth: The Importance of Howard Hawks and John Ford for Political Philosophy (Castle Lectures Series),Robert B. Pippin,3.87,63,1,72
7610,7575,Hillbilly: A Cultural History of an American Icon,Anthony Harkins,really,liked,1,72
7611,7575,Twisted: The Collected Short Stories,Jeffery Deaver,3.92,"4,925",1,72
7612,7575,"13 Bullets (Laura Caxton, #1)",David Wellington,3.64,"4,334",1,72
7613,7575,Silence of the Grave,Arnaldur Indriðason,3.96,"19,292",1,72
7614,7575,The Miles Between,Mary E. Pearson,3.76,"1,367",1,72
7615,7575,The Art of Travel,Alain de Botton,3.83,"23,124",1,72
7616,7575,"Muse and Reverie (Newford, #13)",Charles de Lint,4.21,"1,352",1,72
7617,7575,Racing the Moon,Michelle  Morgan,3.39,36,1,72
7618,7575,"Strings (Hard Rock Harlots, #1)",Kendall Grey,3.93,"9,213",1,72
7619,7575,Inés of My Soul,Isabel Allende,3.97,"27,824",1,72
7620,7575,The Devil's Detective (Thomas Fool #1),Simon Kurt Unsworth,3.69,"1,990",1,72
7621,7575,Through Other Continents: American Literature across Deep Time,Wai Chee Dimock,3.76,41,1,72
7622,7575,"Illusion (Chronicles of Nick, #5)",Sherrilyn Kenyon,4.39,"11,960",1,72
7623,7575,Y: The Last Man - The Deluxe Edition Book One,Brian K. Vaughan,4.31,"16,957",1,72
7624,7575,Somewhere in France (The Great War #1),Jennifer Robson,3.80,"12,293",1,72
7625,7575,Dear Amy,Helen Callaghan,3.59,"9,343",1,72
7626,7575,Lucy,Laurence Gonzales,3.49,"2,408",1,72
7627,7575,"Killer Insight (Psychic Eye Mystery, #4)",Victoria Laurie,4.06,"6,338",1,72
7628,7575,"The Girl Who Saved Christmas (Christmas, #2)",Matt Haig,4.15,"6,801",1,72
7629,7575,"Hard Light (Cass Neary, #3)",Elizabeth Hand,3.91,678,1,72
7630,7575,"Spicy Math (Crystal Joy, #1)",Celia Fay,3.29,7,1,72
