2323,2313,Astrophysics for People in a Hurry,Neil deGrasse Tyson,4.09,"163,480",2,166
2324,2313,"No Place to Hide: Edward Snowden, the NSA, and the U.S. Surveillance State",Glenn Greenwald,4.07,"14,262",2,166
2325,2326,On Bullshit,Harry G. Frankfurt,3.59,"12,981",2,165
2326,2326,Pictures of Nothing: Abstract Art Since Pollock,Kirk Varnedoe,4.26,475,2,165
2327,2326,"Lean Mean Thirteen (Stephanie Plum, #13)",Janet Evanovich,4.10,"94,641",2,165
2328,2326,"Finger Lickin' Fifteen (Stephanie Plum, #15)",Janet Evanovich,4.01,"87,480",2,165
2329,2326,About Alice,Calvin Trillin,4.01,"6,675",2,165
2330,2326,The 10000 Year Explosion: How Civilization Accelerated Human Evolution,Gregory Cochran,3.94,"1,689",2,165
2331,2326,Falling Together,Marisa de los Santos,3.58,"11,536",2,165
2332,2326,Among Others,Jo Walton,3.70,"23,815",2,165
2333,2326,"The Sins of the Father (The Clifton Chronicles, #2)",Jeffrey Archer,4.09,"60,220",3,165
2334,2326,Queen of Scots: The True Life of Mary Stuart,John Guy,3.94,"4,543",2,165
2335,2326,"Predator's Gold (Mortal Engines Quartet, #2)",Philip Reeve,3.93,"23,146",2,165
2336,2326,"Finders Keepers (Bill Hodges Trilogy, #2)",Stephen King,4.06,"136,923",2,165
2337,2326,Recursion,Blake Crouch,4.16,"200,502",2,165
2338,2339,"Mortal Prey (Lucas Davenport, #13)",John Sandford,4.24,"19,795",2,164
2339,2339,The Submission,Amy Waldman,3.67,"12,722",2,164
2340,2339,The Coffee Trader,David Liss,3.74,"8,604",2,164
2341,2339,"Citadel (Languedoc, #3)",Kate Mosse,3.96,"9,420",2,164
2342,2339,"A Natural History of Dragons (The Memoirs of Lady Trent, #1)",Marie Brennan,3.84,"32,364",2,164
2343,2339,"Wolf Brother (Chronicles of Ancient Darkness, #1)",Michelle Paver,4.20,"25,956",2,164
2344,2339,The Boy Who Harnessed the Wind: Creating Currents of Electricity and Hope,William Kamkwamba,4.07,"28,739",2,164
2345,2339,"Three Sisters, Three Queens (The Plantagenet and Tudor Novels, #8)",Philippa Gregory,3.79,"29,115",3,164
2346,2339,Stick Man,Julia Donaldson,4.28,"6,454",3,164
2347,2339,"Act Your Age, Eve Brown (The Brown Sisters, #3)",Talia Hibbert,4.14,"75,445",2,164
2348,2339,"Tuck (King Raven, #3)",Stephen R. Lawhead,4.11,"7,252",2,164
2349,2350,The Story of Forgetting,Stefan Merrill Block,3.66,"2,398",2,163
2350,2350,في القدس,تميم البرغوثي,4.29,"2,640",2,163
2351,2350,"The Spook's Nightmare (The Last Apprentice / Wardstone Chronicles, #7)",Joseph   Delaney,4.18,"13,833",3,163
2352,2350,The Black Swan: The Impact of the Highly Improbable,Nassim Nicholas Taleb,3.95,"106,625",2,163
2353,2350,"Darwin, His Daughter, and Human Evolution",Randal Keynes,3.83,584,2,163
2354,2350,"A Conspiracy of Kings (The Queen's Thief, #4)",Megan Whalen Turner,4.10,"25,486",2,163
2355,2350,This Star Won't Go Out: The Life and Words of Esther Grace Earl,Esther Earl,4.15,"15,989",2,163
2356,2350,The Universe in a Single Atom: The Convergence of Science and Spirituality,Dalai Lama XIV,4.02,"9,377",2,163
2357,2350,The Faraway Nearby (ALA Notable Books for Adults),Rebecca Solnit,4.21,"6,807",2,163
2358,2350,The Nickel Boys,Colson Whitehead,4.26,"225,162",3,163
2359,2350,Radio Silence,Alice Oseman,4.21,"92,662",2,163
2360,2361,The Third Witch,Rebecca Reisert,3.70,649,2,162
2361,2361,The Master Butchers Singing Club,Louise Erdrich,4.06,"24,344",2,162
2362,2361,Observatory Mansions,Edward Carey,3.91,"1,739",2,162
2363,2361,"Shadowfever (Fever, #5)",Karen Marie Moning,4.39,"106,521",2,162
2364,2361,"The Last Colony (Old Man's War, #3)",John Scalzi,4.08,"60,956",3,162
2365,2361,Footnotes in Gaza,Joe Sacco,4.32,"5,562",2,162
2366,2361,"I Only Have Eyes for You (San Francisco Sullivans, #4; The Sullivans, #4)",Bella Andre,4.20,"15,837",2,162
2367,2361,"Hood (King Raven, #1)",Stephen R. Lawhead,3.89,"14,378",3,162
2368,2361,Will Storr vs. The Supernatural: One Man's Search for the Truth About Ghosts,Will Storr,3.94,"1,015",2,162
2369,2361,When a Crocodile Eats the Sun: A Memoir of Africa,Peter Godwin,4.16,"8,775",2,162
2370,2361,"Cheating Death, Stealing Life: The Eddie Guerrero Story",Eddie Guerrero,4.19,"1,321",2,162
2371,2361,"Half a King (Shattered Sea, #1)",Joe Abercrombie,3.97,"61,049",2,162
2372,2361,"The Fairy-Tale Detectives (The Sisters Grimm, #1)",Michael Buckley,4.04,"53,661",2,162
2373,2361,Say Nothing: A True Story of Murder and Memory in Northern Ireland,Patrick Radden Keefe,4.45,"89,242",2,162
2374,2361,"Morning Star (Red Rising Saga, #3)",Pierce Brown,4.49,"169,804",2,162
2375,2376,I Am Not Myself These Days,Josh Kilmer-Purcell,3.95,"14,144",2,161
2376,2376,Wonderstruck,Brian Selznick,4.17,"56,772",3,161
2377,2376,The Better Angels of Our Nature: Why Violence Has Declined,Steven Pinker,4.16,"27,516",3,161
2378,2376,"Intervention (Intervention, #1)",Terri Blackstock,4.19,"6,660",2,161
2379,2376,"Emperor of Thorns (The Broken Empire, #3)",Mark  Lawrence,4.24,"51,034",2,161
2380,2376,"City of Stairs (The Divine Cities, #1)",Robert Jackson Bennett,4.09,"32,865",2,161
2381,2376,"Scythe (Arc of a Scythe, #1)",Neal Shusterman,4.33,"258,969",2,161
2382,2383,"Gone (FBI Profiler, #5)",Lisa Gardner,4.19,"44,497",2,160
2383,2383,Clara Callan,Richard B. Wright,3.87,"9,015",2,160
2384,2383,Batman: The Dark Knight Strikes Again,Frank Miller,3.20,"15,253",2,160
2385,2383,The Divide,Nicholas Evans,3.75,"8,711",2,160
2386,2383,Point Omega,Don DeLillo,3.44,"8,989",2,160
2387,2383,Animals in Translation: Using the Mysteries of Autism to Decode Animal Behavior (A Harvest Book),Temple Grandin,4.14,"9,307",2,160
2388,2383,"Far from the Tree: Parents, Children, and the Search for Identity",Andrew Solomon,4.25,"20,618",2,160
2389,2383,Elizabeth Is Missing,Emma Healey,3.72,"65,417",2,160
2390,2383,Snow White and Russian Red,Dorota Masłowska,3.35,"2,472",2,160
2391,2383,"The White Princess (The Plantagenet and Tudor Novels, #5)",Philippa Gregory,3.92,"43,232",3,160
2392,2383,The Twelve Lives of Samuel Hawley,Hannah Tinti,3.89,"16,360",2,160
2393,2394,"Every Which Way But Dead (The Hollows, #3)",Kim Harrison,4.28,"69,746",3,159
2394,2394,"The Living Blood (African Immortals, #2)",Tananarive Due,4.34,"2,489",2,159
2395,2394,"Halo (Halo, #1)",Alexandra Adornetto,3.66,"68,168",3,159
2396,2394,"If You Were Mine (San Francisco Sullivans, #5; The Sullivans, #5)",Bella Andre,4.25,"12,879",2,159
2397,2394,"The Burning Land (The Saxon Stories, #5)",Bernard Cornwell,4.31,"34,830",2,159
2398,2394,Hornet Flight,Ken Follett,3.96,"23,793",2,159
2399,2394,I Remember Nothing: and Other Reflections,Nora Ephron,3.79,"28,809",2,159
2400,2394,Auringon ydin,Johanna Sinisalo,3.86,"3,512",2,159
2401,2394,Don't Waste Your Life,John Piper,4.12,"31,306",2,159
2402,2394,Atlas of Remote Islands: Fifty Islands I Have Never Set Foot On and Never Will,Judith Schalansky,4.24,"4,243",2,159
2403,2394,The Long Weekend,Ross Lennon,4.53,38,2,159
2404,2405,Unequal Protection: The Rise of Corporate Dominance and the Theft of Human Rights,Thom Hartmann,4.20,609,2,158
2405,2405,Kraken,China Miéville,3.61,"25,727",3,158
2406,2405,"Left To Die (Alvarez & Pescoli, #1)",Lisa Jackson,4.05,"13,573",2,158
2407,2405,"Fuzzy Nation (Fuzzy Sapiens, #7)",John Scalzi,4.13,"29,390",2,158
2408,2405,The Heretic Queen,Michelle Moran,4.21,"24,562",2,158
2409,2405,"Stormbird (Wars of the Roses, #1)",Conn Iggulden,3.91,"14,173",2,158
2410,2405,"Breaking Night: A Memoir of Forgiveness, Survival, and My Journey from Homeless to Harvard",Liz Murray,4.21,"20,271",2,158
2411,2405,Here,Richard McGuire,4.20,"12,119",2,158
2412,2405,Nomadland: Surviving America in the Twenty-First Century,Jessica Bruder,4.04,"44,658",2,158
2413,2405,The Vanishing Half,Brit Bennett,4.16,"681,722",2,158
2414,2415,So You Don't Want to Go to Church Anymore,Wayne Jacobsen,4.05,"2,900",2,157
2415,2415,"Rules of Attraction (Perfect Chemistry, #2)",Simone Elkeles,4.18,"86,931",2,157
2416,2415,"Hard Bitten (Chicagoland Vampires, #4)",Chloe Neill,4.14,"38,360",2,157
2417,2415,The Kitchen Boy: A Novel of the Last Tsar,Robert Alexander,3.91,"14,542",3,157
2418,2415,"The Winter Rose (The Tea Rose, #2)",Jennifer Donnelly,4.32,"22,469",2,157
2419,2415,"Enna Burning (The Books of Bayern, #2)",Shannon Hale,3.99,"41,781",3,157
2420,2415,"The Age of Insight: The Quest to Understand the Unconscious in Art, Mind, and Brain, from Vienna 1900 to the Present",Eric R. Kandel,4.21,"1,589",2,157
2421,2415,"The Arctic Incident  (Artemis Fowl, #2)",Eoin Colfer,3.96,"150,480",3,157
2422,2415,"The Last Hunter: Descent (Antarktos Saga, #1)",Jeremy Robinson,4.04,"1,579",2,157
2423,2415,"Autumn (Seasonal Quartet, #1)",Ali Smith,3.69,"69,365",2,157
2424,2415,"Girls of Paper and Fire (Girls of Paper and Fire, #1)",Natasha Ngan,3.82,"49,641",2,157
2425,2426,"Firelight (Firelight, #1)",Sophie Jordan,3.85,"67,435",2,156
2426,2426,The Woman Upstairs,Claire Messud,3.31,"32,451",2,156
2427,2426,The Crusades: The Authoritative History of the War for the Holy Land,Thomas Asbridge,4.20,"5,230",2,156
2428,2426,The Children Act,Ian McEwan,3.72,"75,231",2,156
2429,2426,East of the Sun,Julia Gregson,3.70,"7,913",2,156
2430,2426,The Japanese Lover,Isabel Allende,3.86,"78,731",2,156
2431,2426,"The Raven King (The Raven Cycle, #4)",Maggie Stiefvater,4.26,"135,191",2,156
2432,2433,They Would Never Hurt a Fly,Slavenka Drakulić,4.21,"1,688",2,155
2433,2433,"American Bloomsbury: Louisa May Alcott, Ralph Waldo Emerson, Margaret Fuller, Nathaniel Hawthorne, and Henry David Thoreau: Their Lives, Their Loves, Their Work",Susan Cheever,3.61,"1,515",2,155
2434,2433,New York,Edward Rutherfurd,4.17,"38,584",2,155
2435,2433,"Mister Monday (The Keys to the Kingdom, #1)",Garth Nix,3.80,"37,622",2,155
2436,2433,Chasing Fire,Nora Roberts,4.13,"39,153",2,155
2437,2433,Physics of the Impossible,Michio Kaku,4.09,"38,275",2,155
2438,2433,2 States: The Story of My Marriage,Chetan Bhagat,3.43,"93,385",2,155
2439,2433,The Wasted Vigil,Nadeem Aslam,3.72,"1,893",2,155
2440,2433,Het huis van de moskee,Kader Abdolah,4.10,"11,413",2,155
2441,2433,"Death of Kings (The Saxon Stories, #6)",Bernard Cornwell,4.30,"28,703",2,155
2442,2433,Knockemstiff,Donald Ray Pollock,3.98,"9,461",2,155
2443,2433,The Places That Scare You: A Guide to Fearlessness in Difficult Times,Pema Chödrön,4.22,"18,836",2,155
2444,2433,"What If? Serious Scientific Answers to Absurd Hypothetical Questions (What If?, #1)",Randall Munroe,4.14,"164,192",2,155
2445,2433,Braiding Sweetgrass,Robin Wall Kimmerer,4.56,"87,424",2,155
2446,2433,"The Lost Colony (Artemis Fowl, #5)",Eoin Colfer,4.01,"154,059",2,155
2447,2448,Batman: Whatever Happened to the Caped Crusader?,Neil Gaiman,3.98,"18,887",3,154
2448,2448,New and Collected Poems: 1931-2001,Czesław Miłosz,4.34,"2,026",2,154
2449,2448,"Prodigal Son (Dean Koontz's Frankenstein, #1)",Dean Koontz,4.03,"35,437",2,154
2450,2448,The Secret Life of CeeCee Wilkes,Diane Chamberlain,4.12,"52,286",2,154
2451,2448,Charlotte's Web/Stuart Little Slipcase Gift Set,E.B. White,4.39,"5,940",2,154
2452,2448,Roses in Winter: An Extraordinary Journey of Love,Leslie D. Stuart,3.99,157,2,154
2453,2448,"Outpost (Razorland, #2)",Ann Aguirre,4.10,"32,537",2,154
2454,2448,"Towers of Midnight (The Wheel of Time, #13)",Robert Jordan,4.46,"148,964",2,154
2455,2448,Factfulness: Ten Reasons We're Wrong About the World – and Why Things Are Better Than You Think,Hans Rosling,4.36,"170,656",2,154
2456,2457,Conservatives Without Conscience,John W. Dean,3.98,"1,730",2,153
2457,2457,Secret Son,Laila Lalami,3.48,"1,533",2,153
2458,2457,Big Russ & Me: Father and Son: Lessons of Life,Tim Russert,4.15,"4,460",3,153
2459,2457,"Haunted (Women of the Otherworld, #5)",Kelley Armstrong,4.07,"26,738",3,153
2460,2457,"What Doesn't Kill You (Catherine Ling, #2)",Iris Johansen,3.96,"6,099",2,153
2461,2457,The Book of Joe,Jonathan Tropper,3.97,"18,705",2,153
2462,2457,Crow Lake,Mary Lawson,3.98,"22,680",2,153
2463,2457,"Enclave (Razorland, #1)",Ann Aguirre,3.91,"68,815",2,153
2464,2457,"The Mandibles: A Family, 2029–2047",Lionel Shriver,3.69,"10,268",2,153
2465,2466,"Bones of the Hills (Conqueror, #3)",Conn Iggulden,4.37,"19,593",2,152
2466,2466,A Song in My Heart - Including CD with Original Musical Score,Roma Calatayud-Stocks,3.94,50,2,152
2467,2466,"Naked Prey (Lucas Davenport, #14)",John Sandford,4.25,"19,802",2,152
2468,2466,Zone One,Colson Whitehead,3.26,"23,148",2,152
2469,2466,Song of the Sparrow,Lisa Ann Sandell,4.08,"10,171",2,152
2470,2466,Baby Jane,Sofi Oksanen,3.41,"3,730",2,152
2471,2466,"Faithful Place (Dublin Murder Squad, #3)",Tana French,3.99,"114,865",3,152
2472,2466,The Twilight Saga Complete Collection,Stephenie Meyer,4.34,"74,522",2,152
2473,2466,Brick Lane,Monica Ali,3.45,"32,189",2,152
2474,2466,The Age of Wonder: How the Romantic Generation Discovered the Beauty and Terror of Science,Richard  Holmes,3.97,"9,329",2,152
2475,2466,An Officer and a Spy,Robert   Harris,4.20,"26,439",2,152
2476,2466,We Should All Be Feminists,Chimamanda Ngozi Adichie,4.41,"269,862",2,152
2477,2466,Shoe Dog: A Memoir by the Creator of Nike,Phil Knight,4.47,"258,163",2,152
2478,2479,The Total Money Makeover: A Proven Plan for Financial Fitness,Dave Ramsey,4.23,"85,874",2,151
2479,2479,"Deepsix (The Academy, #2)",Jack McDevitt,3.88,"4,634",2,151
2480,2479,"Jack the Ripper and Black Magic: Victorian Conspiracy Theories, Secret Societies and the Supernatural Mystique of the Whitechapel Murders",Spiro Dimolianis,3.69,88,2,151
2481,2479,Cloaked,Alex Flinn,3.64,"15,166",2,151
2482,2479,I Am Forbidden,Anouk Markovits,3.69,"5,668",2,151
2483,2484,"Lover Revealed (Black Dagger Brotherhood, #4)",J.R. Ward,4.29,"133,580",3,150
2484,2484,Mapping Human History: Discovering the Past Through Our Genes,Steve  Olson,3.94,"1,034",2,150
2485,2484,Eleanor Rigby,Douglas Coupland,3.66,"10,072",2,150
2486,2484,Liquidation,Imre Kertész,3.79,"1,259",3,150
2487,2484,"Summer Knight (The Dresden Files, #4)",Jim Butcher,4.27,"144,628",3,150
2488,2484,"Thirteenth Child (Frontier Magic, #1)",Patricia C. Wrede,3.83,"11,653",2,150
2489,2484,"Without You, There Is No Us: My Time with the Sons of North Korea's Elite",Suki Kim,3.93,"19,512",2,150
2490,2484,The Years of Rice and Salt,Kim Stanley Robinson,3.75,"13,269",2,150
2491,2484,Whipping Girl: A Transsexual Woman on Sexism and the Scapegoating of Femininity,Julia Serano,4.25,"7,409",2,150
2492,2493,Juliet,Anne Fortier,3.91,"27,087",2,149
2493,2493,You've Been Warned,James Patterson,3.53,"22,667",3,149
2494,2493,"The Luxe (Luxe, #1)",Anna Godbersen,3.64,"71,952",2,149
2495,2493,This is Where I Leave You,Jonathan Tropper,3.88,"141,568",2,149
2496,2493,Journey to the River Sea,Eva Ibbotson,4.20,"15,239",2,149
2497,2493,Convenience Store Woman,Sayaka Murata,3.70,"219,037",2,149
2498,2499,"The Hidden Gallery (The Incorrigible Children of Ashton Place, #2)",Maryrose Wood,4.09,"9,428",2,148
2499,2499,"Old Filth (Old Filth, #1)",Jane Gardam,3.95,"17,269",2,148
2500,2499,Wesley the Owl: The Remarkable Love Story of an Owl and His Girl,Stacey O'Brien,4.08,"11,738",2,148
2501,2499,"Daughters of Rome (The Empress of Rome, #1)",Kate Quinn,really,liked,2,148
2502,2499,Nine Perfect Strangers,Liane Moriarty,3.54,"397,732",2,148
2503,2504,"Bones to Ashes (Temperance Brennan, #10)",Kathy Reichs,3.95,"29,724",2,147
2504,2504,The Wilder Life: My Adventures in the Lost World of Little House on the Prairie,Wendy McClure,3.48,"7,930",3,147
2505,2504,"Stolen (Women of the Otherworld, #2)",Kelley Armstrong,4.14,"45,848",3,147
2506,2504,"Effortless (Thoughtless, #2)",S.C. Stephens,4.35,"115,207",2,147
2507,2504,Prep,Curtis Sittenfeld,3.42,"66,879",2,147
2508,2504,The Sports Gene: Inside the Science of Extraordinary Athletic Performance,David   Epstein,4.20,"14,174",2,147
2509,2504,Two Brothers,Ben Elton,4.38,"12,849",2,147
2510,2504,How to Be an Antiracist,Ibram X. Kendi,4.38,"109,197",3,147
2511,2504,My Dark Vanessa,Kate Elizabeth Russell,4.09,"266,859",2,147
2512,2513,"Grave Secrets (Temperance Brennan, #5)",Kathy Reichs,3.98,"33,489",2,146
2513,2513,"Bare Bones (Temperance Brennan, #6)",Kathy Reichs,3.97,"38,243",2,146
2514,2513,"Monday Mourning (Temperance Brennan, #7)",Kathy Reichs,4.04,"33,628",2,146
2515,2513,"Valiant (Modern Faerie Tales, #2)",Holly Black,3.83,"41,541",2,146
2516,2513,"Hot, Flat, and Crowded: Why We Need a Green Revolution – and How It Can Renew America",Thomas L. Friedman,3.71,"13,674",2,146
2517,2513,No Easy Day: The Firsthand Account of the Mission That Killed Osama Bin Laden,Mark Owen,4.01,"52,323",2,146
2518,2513,"Syren (Septimus Heap, #5)",Angie Sage,4.11,"33,731",2,146
2519,2513,Getting Things Done: The Art of Stress-Free Productivity,David    Allen,really,liked,2,146
2520,2513,"Imperium (Cicero, #1)",Robert   Harris,4.11,"32,488",3,146
2521,2513,"Break No Bones (Temperance Brennan, #9)",Kathy Reichs,3.97,"29,516",2,146
2522,2513,Understanding Power: The Indispensable Chomsky,Noam Chomsky,4.42,"8,387",2,146
2523,2524,From a Buick 8,Stephen King,3.47,"66,523",2,145
2524,2524,What I Was,Meg Rosoff,3.49,"4,395",2,145
2525,2524,"The Final Warning (Maximum Ride, #4)",James Patterson,3.85,"69,506",3,145
2526,2524,Caleb's Crossing,Geraldine Brooks,3.84,"65,134",3,145
2527,2524,"Captured (The Captive, #1)",Erica Stevens,4.02,"20,296",3,145
2528,2524,"Taggerung (Redwall, #14)",Brian Jacques,4.15,"15,879",3,145
2529,2524,An Elephant in the Garden,Michael Morpurgo,4.18,"8,444",2,145
2530,2524,Tell Me Three Things,Julie Buxbaum,4.04,"76,900",2,145
2531,2532,"Shatter (Joseph O'Loughlin, #3)",Michael Robotham,4.14,"10,652",2,144
2532,2532,"Attack of the Fiend (The Last Apprentice / Wardstone Chronicles, #4)",Joseph   Delaney,4.21,"22,820",3,144
2533,2532,"Geist (Book of the Order, #1)",Philippa Ballantine,3.64,"3,936",2,144
2534,2532,The Promise of Happiness,Justin Cartwright,3.28,"1,066",2,144
2535,2532,"Queste (Septimus Heap, #4)",Angie Sage,4.06,"52,845",2,144
2536,2532,The Popes: A History,John Julius Norwich,3.71,"3,145",2,144
2537,2532,The Humans,Matt Haig,4.08,"102,737",2,144
2538,2532,Three-Martini Lunch,Suzanne Rindell,3.81,"2,415",2,144
2539,2532,Indignation,Philip Roth,3.76,"16,597",2,144
2540,2541,Consumption,Kevin Patterson,3.79,744,2,143
2541,2541,"Claimed by Shadow (Cassandra Palmer, #2)",Karen Chance,3.97,"22,679",3,143
2542,2541,"The Flavor Bible: The Essential Guide to Culinary Creativity, Based on the Wisdom of America's Most Imaginative Chefs",Andrew Dornenburg,4.02,"20,937",3,143
2543,2541,The Story of Beautiful Girl,Rachel Simon,3.93,"26,467",2,143
2544,2541,Heaven,Randy Alcorn,4.27,"12,598",2,143
2545,2541,Peace,Richard Bausch,3.82,"1,010",2,143
2546,2541,"The Unwanteds (Unwanteds, #1)",Lisa McMann,4.12,"38,309",2,143
2547,2541,Upheaval: Turning Points for Nations in Crisis,Jared Diamond,3.90,"9,272",2,143
2548,2541,The Book of Delights: Essays,Ross Gay,4.18,"11,921",2,143
2549,2550,"The Spook's Sacrifice (The Last Apprentice / Wardstone Chronicles, #6)",Joseph   Delaney,4.20,"14,813",3,142
2550,2550,Color: A Natural History of the Palette,Victoria Finlay,3.81,"67,447",2,142
2551,2550,"Broken (Women of the Otherworld, #6)",Kelley Armstrong,4.18,"31,138",3,142
2552,2550,"Physik (Septimus Heap, #3)",Angie Sage,4.01,"53,093",2,142
2553,2550,Doctor Who: Night of the Humans,David Llewellyn,3.70,"1,462",2,142
2554,2550,A Thousand Naked Strangers: A Paramedic's Wild Ride to the Edge and Back,Kevin Hazzard,3.92,"11,691",2,142
2555,2550,Her Body and Other Parties: Stories,Carmen Maria Machado,3.87,"76,596",2,142
2556,2550,Hunger: A Memoir of (My) Body,Roxane Gay,4.18,"104,228",2,142
2557,2558,Mr. Timothy,Louis Bayard,3.60,"2,590",2,141
2558,2558,"The Spook's Mistake (The Last Apprentice / Wardstone Chronicles, #5)",Joseph   Delaney,4.22,"16,707",3,141
2559,2558,"Queen of Song and Souls (Tairen Soul, #4)",C.L. Wilson,4.28,"9,595",2,141
2560,2558,The Collected Stories of Lydia Davis,Lydia Davis,4.26,"6,221",2,141
2561,2558,Negro President: Jefferson and the Slave Power,Garry Wills,3.74,260,2,141
2562,2558,The Outlander,Gil Adamson,3.74,"10,099",2,141
2563,2558,"TimeRiders (TimeRiders, #1)",Alex Scarrow,3.82,"12,325",2,141
2564,2558,"Sepulchre (Languedoc, #2)",Kate Mosse,3.79,"20,626",2,141
2565,2558,"An Indigenous Peoples' History of the United States (ReVisioning American History, #3)",Roxanne Dunbar-Ortiz,4.37,"14,505",2,141
2566,2558,"Shadows of Self (Mistborn, #5)",Brandon Sanderson,4.29,"128,747",2,141
2567,2568,Judge & Jury,James Patterson,4.01,"49,414",2,140
2568,2568,Heart of a Samurai,Margi Preus,3.94,"7,478",2,140
2569,2568,Cleopatra: A Life,Stacy Schiff,3.72,"114,381",3,140
2570,2568,"Drop of Doubt (The Ghost Bird, #5)",C.L. Stone,4.42,"9,087",2,140
2571,2568,Dying Gasp (Chief Inspector Mario Silva #3),Leighton Gage,3.88,275,2,140
2572,2568,"The Sunday Philosophy Club (Isabel Dalhousie, #1)",Alexander McCall Smith,3.36,"23,103",2,140
2573,2568,"Sing, Unburied, Sing",Jesmyn Ward,4.01,"128,041",2,140
2574,2568,Norse Mythology,Neil Gaiman,4.10,"297,084",2,140
2575,2568,On Tyranny: Twenty Lessons from the Twentieth Century,Timothy Snyder,4.19,"59,407",2,140
2576,2568,The Power,Naomi Alderman,3.77,"212,334",2,140
2577,2578,"Incubus Dreams (Anita Blake, Vampire Hunter, #12)",Laurell K. Hamilton,3.80,"49,366",3,139
2578,2578,"The Eighty-Dollar Champion: Snowman, the Horse That Inspired a Nation",Elizabeth Letts,4.22,"13,028",2,139
2579,2578,"The Last Mughal: The Fall of a Dynasty: Delhi, 1857",William Dalrymple,4.17,"7,623",2,139
2580,2578,"Angel (Maximum Ride, #7)",James Patterson,really,liked,2,139
2581,2578,Moon Over Manifest,Clare Vanderpool,4.04,"33,612",2,139
2582,2578,"The Death of Kings (Emperor, #2)",Conn Iggulden,4.29,"18,663",2,139
2583,2578,Why Does the World Exist?: An Existential Detective Story,Jim Holt,3.80,"6,460",2,139
2584,2578,The Hakawati,Rabih Alameddine,3.95,"4,171",2,139
2585,2578,"Styxx (Dark-Hunter, #22)",Sherrilyn Kenyon,4.58,"21,831",2,139
2586,2578,A Paradise Built in Hell: The Extraordinary Communities That Arise in Disaster,Rebecca Solnit,3.95,"3,064",2,139
2587,2588,When Will Jesus Bring the Pork Chops?,George Carlin,3.81,"12,155",3,138
2588,2588,"Ink Exchange (Wicked Lovely, #2)",Melissa Marr,3.69,"61,605",2,138
2589,2588,"Wake (Wake, #1)",Lisa McMann,3.75,"80,778",2,138
2590,2588,"Dark Currents (The Emperor's Edge, #2)",Lindsay Buroker,4.24,"7,911",2,138
2591,2588,The 19th Wife,David Ebershoff,3.65,"58,702",2,138
2592,2588,"The Confessor (Gabriel Allon, #3)",Daniel Silva,4.19,"30,752",2,138
2593,2594,The Speckled People: A Memoir of a Half-Irish Childhood,Hugo Hamilton,3.75,"1,412",2,137
2594,2594,"Every Boy's Got One (Boy, #3)",Meg Cabot,3.76,"24,314",2,137
2595,2594,Magic Hour,Kristin Hannah,4.16,"105,825",2,137
2596,2594,Brodeck's Report,Philippe Claudel,4.14,"5,326",2,137
2597,2594,Willow,Julia Hoban,3.91,"32,337",2,137
2598,2594,"Melting Stones (Circle Reforged, #2)",Tamora Pierce,3.86,"12,518",2,137
2599,2594,The Big Burn: Teddy Roosevelt and the Fire That Saved America,Timothy Egan,4.11,"15,514",2,137
2600,2594,"Peeps (Peeps, #1)",Scott Westerfeld,3.77,"24,629",2,137
2601,2594,Madame Tussaud: A Novel of the French Revolution,Michelle Moran,3.96,"21,292",2,137
2602,2594,"Nevermore (Maximum Ride, #8)",James Patterson,3.89,"37,151",2,137
2603,2594,"Girl of Nightmares (Anna, #2)",Kendare Blake,3.85,"30,976",2,137
2604,2594,The Street of a Thousand Blossoms,Gail Tsukiyama,3.97,"9,970",2,137
2605,2594,"One of Our Thursdays Is Missing (Thursday Next, #6)",Jasper Fforde,3.97,"19,101",3,137
2606,2594,"City of Bones / City of Ashes / City of Glass / City of Fallen Angels / City of Lost Souls (The Mortal Instruments, #1-5)",Cassandra Clare,4.57,"14,693",2,137
2607,2594,"The Last Hunter: Onslaught (Antarktos Saga, #5)",Jeremy Robinson,4.45,777,2,137
2608,2594,Railsea,China Miéville,3.89,"12,620",2,137
2609,2594,"P.S. I Still Love You (To All the Boys I've Loved Before, #2)",Jenny Han,4.04,"345,357",2,137
2610,2594,"By Royal Command (Young Bond, #5)",Charlie Higson,4.15,"4,004",2,137
2611,2612,Murder in Amsterdam: The Death of Theo van Gogh and the Limits of Tolerance,Ian Buruma,3.71,"1,589",2,136
2612,2612,What Was She Thinking? [Notes on a Scandal],Zoë Heller,3.73,"22,167",2,136
2613,2612,"Phantom Prey (Lucas Davenport, #18)",John Sandford,4.04,"17,966",2,136
2614,2612,Bloom,Elizabeth Scott,3.70,"13,591",2,136
2615,2612,My Stroke of Insight,Jill Bolte Taylor,3.90,"28,000",3,136
2616,2612,419,Will Ferguson,3.62,"12,221",2,136
2617,2612,"The 100 (The 100, #1)",Kass Morgan,3.57,"70,015",2,136
2618,2612,The Salt Roads,Nalo Hopkinson,3.85,"2,290",2,136
2619,2612,"William Shakespeare's The Empire Striketh Back (William Shakespeare's Star Wars, #5)",Ian Doescher,4.30,"4,944",2,136
2620,2621,A Venetian Affair: A True Tale of Forbidden Love in the 18th Century,Andrea di Robilant,3.46,"1,303",2,135
2621,2621,A Gathering Light,Jennifer Donnelly,3.83,"43,251",2,135
2622,2621,A Secret Kept,Tatiana de Rosnay,3.36,"27,089",2,135
2623,2621,"Flyte (Septimus Heap, #2)",Angie Sage,4.01,"71,125",2,135
2624,2621,"The Happiness Project: Or Why I Spent a Year Trying to Sing in the Morning, Clean My Closets, Fight Right, Read Aristotle, and Generally Have More Fun",Gretchen Rubin,3.64,"166,363",2,135
2625,2621,Chasm City,Alastair Reynolds,4.13,"23,936",2,135
2626,2621,"Light (Kefahuchi Tract, #1)",M. John Harrison,3.60,"5,616",2,135
2627,2621,The Heart Goes Last,Margaret Atwood,3.39,"65,045",2,135
2628,2621,Hag-Seed,Margaret Atwood,3.81,"34,150",2,135
2629,2621,The Beauty of Humanity Movement,Camilla Gibb,3.94,"4,448",2,135
2630,2621,The Summer Before the War,Helen Simonson,3.78,"41,183",2,135
2631,2621,"To All the Boys I've Loved Before (To All the Boys I've Loved Before, #1)",Jenny Han,4.06,"808,048",2,135
2632,2621,Anxious People,Fredrik Backman,4.19,"547,283",2,135
2633,2634,The Complete Chronicles of Conan,Robert E. Howard,4.29,"5,053",2,134
2634,2634,"A Red Herring Without Mustard (Flavia de Luce, #3)",Alan Bradley,4.05,"43,165",2,134
2635,2634,The Translator: A Tribesman's Memoir of Darfur,Daoud Hari,3.92,"4,996",2,134
